Number,Publication Number,Title,Technology topic,Application domain,Standardized Current Assignee,Publication Year,Cluster
107,EP4562114A1,"Renewable jet fuel composition having a high content of naphthenic compounds, and associated preparation method",-,Liquid hydrocarbon mixture production|Hydrocarbon oils refining|Hydrocarbon oils treatment products,TOTALENERGIES ONETECH,2025,2
108,WO2024126893A1,A hydrocarbon composition,Alkane|Carbon number|Hydrocotyle bowlesioides|Cyclic hydrocarbon|PARAFFIN HYDROCARBONS|Chemical engineering,Hydrocarbon oil cracking|Liquid carbonaceous fuels|Liquid hydrocarbon mixture production|Hydrocarbon oils treatment products,NESTE OYJ,2024,2
118,EP3508583B1,Method for obtaining integrated biorefineries of lignocellulose biomasses by reusing production units of former oil refineries,-,Bioreactor/fermenter combinations|Biological substance pretreatments|Refining to change hydrocarbon structural skeleton|Biochemistry cleaning apparatus|Gas production bioreactors|Biomass after-treatment|Liquid hydrocarbon mixture production|Enzymology/microbiology apparatus|Fermentation|Specific use bioreactors/fermenters|Refining to eliminate hetero atoms|Hydrocarbon oils treatment|Liquid carbonaceous fuels,WATER & SOIL REMEDIATION,2022,2
130,AU2024204633A1,Blended fuel compositions with improved emissions profiles,Thermodynamics|Biodiesel|Petroleum engineering|Diesel fuel|Chemistry|Mixed fuel,Biofuels|Liquid carbonaceous fuels|Liquid hydrocarbon mixture production|Bio-feedstock|Hydrocarbon oils treatment products,REG SYNTHETIC FUELS LLC,2024,2
134,WO2025031981A1,"An integrated process for the production of LPG, olefins, and aromatic hydrocarbons",Alkane|Ptru catalyst|Hydrocotyle bowlesioides|Oxygen compound|Aromatic hydrocarbon|Alkene|Methane|Chemical engineering,Thermal non-catalytic cracking|Hydrogen|Liquid hydrocarbon mixture production|Treatment with hydrotreatment processes|Hydrogen/synthetic gas production|Hydrocarbon oils treatment products,BASF SE,2025,2
144,EP4490254A1,Process for preparing a jet fuel from renewable feedstock,-,Preparation by ester-hydroxy reaction|Fatty acid esterification|Organic compound preparation|Gaseous fuels|Gas production bioreactors|Hydroxy compound preparation|Gasification processes details|Liquid hydrocarbon mixture production|Combustible gas production|Refining to eliminate hetero atoms|Hydrocarbon oils treatment products,TOTALENERGIES ONETECH,2025,2
148,WO2025034756A1,"Catalytic processes for production of olefins, paraffins, and/or aromatics from mixtures of natural oils, and/or fats",Polymer science|Ptru catalyst|BTEX|Aromatic agent|Alkene|Polymer chemistry|Natural oils|Zeolite,Liquid hydrocarbon mixture production|Bio-feedstock|Hydrocarbon oils treatment products,GEVO INC,2025,2
149,WO2025031974A1,A process for the hydrodeoxygenation and hydrocracking of sustainable feedstocks,Alkane|Ptru catalyst|Hydrodeoxygenation|Process engineering|Oxygen compound|Organic chemistry|Zeolite|Chemical engineering,Liquid hydrocarbon mixture production|Hydrocarbon oils treatment products,BASF SE,2025,2
155,JP2025511827A,再生可能な炭化水素を製造するための方法,Phosphate|Triglyceride|Fatty acid|Phosphorus|Chemical engineering,Liquid carbonaceous fuels|Liquid hydrocarbon mixture production|Bio-feedstock|Hydrocarbon oils refining|Hydrocarbon oils treatment,NESTE OYJ,2025,2
157,WO2024235588A1,Method for hydrotreating and hydroisomerising vegetable oil in one step using at least one sulphide catalyst with a BEA-structure zeolite alone or mixed with a FAU-structure zeolite,Ptru catalyst|Vegetable oil|Fixed bed|Process engineering|Hydrogen treatment|Sulphide compound|Zeolite|Chemical engineering,Liquid hydrocarbon mixture production|Treatment with hydrotreatment processes|Bio-feedstock|Hydrocarbon oils refining|Hydrocarbon oils treatment products,IFP ENERGIES NOUVELLES,2024,2
159,JP2025063154A,バイオ再生可能供給物からジェット燃料を生成するためのプロセス,Thermodynamics|Hydrocotyle bowlesioides|Triglyceride|Heteroatom|Process engineering|Fatty acid|Heavy duty diesel|Jet fuel|Motor fuel|Aviation fuel|Environmental geology,Refining to change hydrocarbon structural skeleton|Hydrocarbon distillation|Biofuels|Liquid hydrocarbon mixture production|Hydrocarbon oil cracking|Treatment with hydrotreatment processes|Bio-feedstock|Hydrocarbon oils treatment products,UOP LLC,2025,2
161,BR102016016875B1,"PROCESSO PARA O HIDROTRATAMENTO DE MATERIAIS RENOVÁVEIS, COM UMA RECICLAGEM DE GÁS APERFEIÇOADA",Alkane|Process engineering|Renewable materials|Hydrogen treatment|Renewable resource|Chemistry|PARAFFIN HYDROCARBONS|Effluent|Liquid fraction,Biofuels|Efficient propulsion technologies|Liquid carbonaceous fuels|Liquid hydrocarbon mixture production|Treatment with hydrotreatment processes|Gaseous mixture working up|Bio-feedstock|Bed hydrotreatment processes apparatus|Hydrocarbon oils treatment products|Refining to eliminate hetero atoms,IFP ENERGIES NOUVELLES,2022,2
163,CN118475671A,Production of hydrocarbons from organic materials of biological origin,Isomerization|Process engineering|Hydrogen treatment|Organic chemistry|Environmental geology,Refining to change hydrocarbon structural skeleton|Liquid carbonaceous fuels|Liquid hydrocarbon mixture production|Treatment with hydrotreatment processes|Bio-feedstock|Refining to eliminate hetero atoms,NESTE OYJ,2024,2
167,CN118146822A,Method and system for producing aviation biofuel by combined hydrogenation process,Biodiesel|Thermodynamics|Hydrogenation reaction|Biofuel|Hydrogenation process|Hydrogen treatment|Aviation biofuel|Treatment unit|Petroleum engineering|Aviation fuel,Liquid hydrocarbon mixture production|Bio-feedstock|Hydrocarbon oils treatment,SINOPEC ENG | SINOPEC ENG GRP CO LTD,2024,2
168,BR112020010420B1,PREPARAÇÃO DE UMA MISTURA DE COMBUSTÍVEL,-,Liquid hydrocarbon mixture production|Liquid carbonaceous fuels|Hydrocarbon oils refining,NESTE OYJ,2024,2
169,MY185369A,Method for revamping a conventional mineral oils refinery to a biorefinery,Vegetable oil|Ptru catalyst|Hydrodesulfurization|Cooking oil|Animal fat|Mineral oil|Raw material|Refinery|Acid gas|Fatty acid ester|Environmental geology|Hydrodeoxygenation|Pollutant emissions|Process engineering|Oil refinery|Treatment unit|Product recovery|Effluent|Biorefinery,Refining to change hydrocarbon structural skeleton|Biofuels|Liquid carbonaceous fuels|Liquid hydrocarbon mixture production|Treatment with hydrotreatment processes|Bio-feedstock|Air quality improvement,ENI SPA,2021,2
172,ES2976502T3,Producción de hidrocarburos a partir de material orgánico reciclado o renovable,Ptru catalyst|Hydrocotyle bowlesioides|Oxygen compound|Hydrogen treatment|Organic chemistry|Hydrogen compounds|Environmental geology|Chemical engineering,Thermal non-catalytic cracking|Catalytic cracking|Solid sorbent liquid separation|Liquid hydrocarbon mixture production|Bio-feedstock|Refining to eliminate hetero atoms|Hydrocarbon oils treatment,NESTE OYJ,2024,2
173,IN535808B,Catalystic process to convert renewable feedstocks directly into aromatics rich feedstock pool,Ptru catalyst|Triglyceride|Petrochemical|Hydrogen treatment|Diglyceride|Cooking oil|Animal fat,-,COUNCIL OF SCI & IND RES,2024,2
174,TH2301000553A,กระบวนการสำหรับการบำบัดด้วยน้ำของวัสดุจากแหล่งหมุนเวียน,-,Liquid hydrocarbon mixture production|Treatment with hydrotreatment processes,SHELL INTERINAT RESKLN BV,2025,2
175,CN114574234B,一种二代生物柴油生产工艺,Biodiesel|Ptru catalyst|Isomerization|Fluid phase|Fractionation|Hydrodeoxygenation|Oil phase|Process engineering|Oil water|Biodiesel production|Oil–water separator|Raw material,Liquid hydrocarbon mixture production|Treatment with hydrotreatment processes|Bio-feedstock|Chemical/physical processes|Hydrocarbon oils treatment products,FUZHOU UNIVERSITY NATIONAL ENGINEERING RESEARCH CENTER OF CHEMICAL FERTILIZER CATALYST,2024,2
176,CN116376595B,一种中低压加氢生产可再生航空燃料的工艺方法,-,Liquid hydrocarbon mixture production|Treatment with hydrotreatment processes|Bio-feedstock,QINGDAO INST OF BIOENERGY & BIOPROCESS TECH CHINESE ACADEMY OF SCI | LONGYAN ZHUOYUE NEW ENERGY CO LTD,2025,2
178,CN116507700A,"Process for producing cracked product fraction comprising propylene, C4 olefins, or both",Alkane|Alkene|Materials science|PARAFFIN HYDROCARBONS|Cracking|Chemical engineering|Propene,Catalytic cracking,NESTE OYJ,2023,2
179,JP2024522114A5,バイオ再生可能な軽質パラフィン系灯油および持続可能航空燃料のためのプロセス,-,Liquid carbonaceous fuels|Liquid hydrocarbon mixture production|Treatment with hydrotreatment processes|Bio-feedstock|Hydrocarbon oils refining|Hydrocarbon oils treatment products,REG SYNTHETIC FUELS LLC,2025,2
180,IN566720B,Process for manufacturing bio-based hydrocarbons and bio-gasoline composition,Process engineering|Polymer composition|Cracking|Chemical engineering,Catalytic cracking|Liquid carbonaceous fuels|Liquid hydrocarbon mixture production,NESTE OYJ,2025,2
182,KR102736547B1,천연 발생 지방 및 오일의 복합 혼합물을 무산소 탄화수소로 탈산소화시키는 데 사용되는 촉매 방법을 보호하기 위한 수력학적 캐비테이션 방법,Naphtha|Hydrocotyle bowlesioides|Acyl group|Environmental engineering|Fatty acid ester|Environmental chemistry,Thermal non-catalytic cracking|Fatty acids production/refining|Refining to change hydrocarbon structural skeleton|Refining by heating/cooling|Liquid hydrocarbon mixture production|Hydrocarbon oil cracking|Treatment with hydrotreatment processes|Bio-feedstock|Hydrocarbon oils treatment products,토탈에너지스 원테크 벨지움,2024,2
183,CN116024004B,一种油脂类原料制备柴油馏分的加氢方法,Oil and grease|Ptru catalyst|Isomerization|Hydrodeoxygenation|Process engineering|Diesel fuel|Raw material|Chemical engineering,Treatment with hydrotreatment processes|Bio-feedstock,CHINA PETROLEUM & CHEMICAL CORP | RES INST OF PETROLEUM PROCESSING SINOPEC,2025,2
184,FR3147810A1,PROCEDE D’HYDROTRAITEMENT D’UNE COMPOSITION D’ORIGINE NATURELLE,Alkane|Natural source|Naphtha|Ptru catalyst|Heteroatom|Hydrogen treatment|Aqueous solution|PARAFFIN HYDROCARBONS|Chemical engineering,Solid fuels|Liquid carbonaceous fuels|Liquid hydrocarbon mixture production,TOTALENERGIES ONETECH,2024,2
185,CN118146829A,Method and system for producing aviation biofuel through combined hydrogenation,Ptru catalyst|Hydrogenation process|Biofuel|Process engineering|Hydrogen treatment|Hydrogen system|Decarburization|Aviation biofuel|Waste management|Chemical engineering|Noble metal,Treatment with hydrotreatment processes,SINOPEC ENG | SINOPEC ENG GRP CO LTD,2024,2
187,CN118389172A,Carbon emission reduction method for producing biological aviation kerosene by using grease waste,Alkane|Oil and grease|Kerosene|Hydrogenation reaction|Waste oil|N alkanes|Hydrogen production|Biomass|Environmental protection|Light hydrocarbons|Hydrogen consumption|Renewable energy,Treatment with hydrotreatment processes,EAST CHINA UNIV OF SCI & TECH | SINOPEC LUOYANG PETROCHEM ENG CORP | SINOPEC ENG GRP CO LTD,2024,2
188,CN118755495A,"Raw oil purification, fluidized bed hydrogenation and fixed bed isomerization combined process for producing biological aviation kerosene (biodiesel)",Biodiesel|Isomerization|Fluidized bed|Hydrogenation reaction|Fixed bed|Process engineering|Biomass|Raw material|Aviation kerosene|Environmental geology|Biomass feedstock|Separation process,Liquid hydrocarbon mixture production|Treatment with hydrotreatment processes,CARBON-CHINA ENERGY TECH (BEIJING) CO LTD,2024,2
189,ID2021PID07136A,METODE PRODUKSI BAHAN BAKAR PENERBANGAN,Aviation|Process engineering|Hydrogen treatment|Components of crude oil|Jet fuel|Aviation fuel|Intermediate product|Liquid fraction|Chemical engineering,Refining to change hydrocarbon structural skeleton|Hydrocarbon oil cracking|Liquid hydrocarbon mixture production|Treatment with hydrotreatment processes|Refining by aromatic hydrocarbon hydrogenation|Refining to eliminate hetero atoms,HALDOR TOPSOE AS,2021,2
190,CN118146878A,Method for producing aviation biofuel from animal and vegetable oil,Hydrogen purity|Vegetable oil|Ptru catalyst|Biofuel|Hydrogen treatment|Decarburization|Aviation biofuel|Noble metal|Hydrogenation reaction|Hydrogenation process|Process engineering|Nickel Carbonyl|Hydrogen partial pressure|Environmental protection|Waste management,Fatty acid hydrogenation|Sequential/parallel process reactions|Gas treatment|Dispersed particle separation|Liquid carbonaceous fuels|Liquid hydrocarbon mixture production|Hydrocarbon oils treatment,SINOPEC ENG | SINOPEC ENG GRP CO LTD,2024,2
193,CN117940535A,Process for producing kerosene from renewable resources,Liquid product|Kerosene|Process engineering|Separation system|Product recovery|Effluent|Environmental geology,Hydrocarbon distillation|Liquid hydrocarbon mixture production|Effluent separation,SHELL INTERNATIONALE RESEARCH MAATSCHAPPIJ BV,2024,2
194,BR112021010437B8,COMPOSIÇÃO DE COMBUSTÍVEL DIESEL,-,Refining to change hydrocarbon structural skeleton|Liquid carbonaceous fuels|Liquid hydrocarbon mixture production|Treatment with hydrotreatment processes|Ether preparation by compound addition|Fuel additives,NESTE OYJ,2024,2
195,ID2021PID07742A,METODE UNTUK PRODUKSI BERSAMA BAHAN BAKAR PENERBANGAN DAN DIESEL,Isomerization|Kerosene|Hydrodeoxygenation|Diluent|Process engineering|Jet fuel|Aviation fuel|Process plant|Diesel fuel|Intermediate product|Liquid fraction|Chemical engineering,Treatment with hydrotreatment processes,HALDOR TOPSOE AS,2021,2
197,IDP000095421B,PROSES DAN INSTALASI UNTUK MEMPRODUKSI HIDROKARBON DENGAN MENGURANGI JEJAK CO2 DAN MENINGKATKAN INTEGRASI HIDROGEN,Natural gas consumption|Thermodynamics|Hydrocotyle bowlesioides|Flue gas|Process engineering|Hydrogen treatment|Hydrogen production|Hydrogen compounds|Decreased carbon dioxide|Environmental geology,Hydrogen separation|Liquid hydrocarbon mixture production,TOPSOE AS,2024,2
199,ID2021PID05878A,METODE UNTUK PRODUKSI BERSAMA BAHAN BAKAR PENERBANGAN DAN DIESEL,Isomerization|Hydrocotyle bowlesioides|Kerosene|Hydrogen treatment|Oxygen compound|Components of crude oil|Jet fuel|Intermediate product|Liquid fraction|Chemical engineering|Hydrodeoxygenation|Diluent|Process engineering|Diesel fuel,Refining to change hydrocarbon structural skeleton|Hydrocarbon oil cracking|Liquid hydrocarbon mixture production|Treatment with hydrotreatment processes|Refining by aromatic hydrocarbon hydrogenation,HALDOR TOPSOE AS,2021,2
201,VN110480A,QUY TRÌNH SẢN XUẤT HYĐROCACBON LỎNG TỪ CÁC NGUỒN TÁI TẠO,Alkane|Ptru catalyst|Isomerization|Hydrocotyle bowlesioides|Liquid hydrocarbons|Liquid carbon|Hydrogen treatment|Organic chemistry|Chemical engineering,Refining to change hydrocarbon structural skeleton|Liquid hydrocarbon mixture production|Treatment with hydrotreatment processes|Refining by aromatic hydrocarbon hydrogenation,SHELL INTERNATIONALE RESEARCH MAATSCHAPPIJ BV,2025,2
202,CN116948672B,一种生物油脂加氢生产低芳烃溶剂油的装置和方法,Liquid product|Aromatic solvent|Hydrodeoxygenation|Process engineering|Cracking reaction|Grease,Liquid hydrocarbon mixture production|Bio-feedstock,CHINA PETROLEUM & CHEMICAL CORP | SINOPEC (DALIAN) PETROCHEMICAL RES INST CO LTD,2025,2
203,AR115066B1,MÉTODO PARA REDUCIR LOS GASES DE EFECTO INVERNADERO (GEI) EN LA PRODUCCIÓN DE COMBUSTIBLE RENOVABLE.,-,Microorganism based processes|Liquid hydrocarbon mixture production|Plant cultivation|Cultivating equipments|Angiosperms/flowering plants,UPM KYMMENE OYJ,2024,2
204,FR3138442A1,COMPOSITION DE CARBURATEUR D’ORIGINE RENOUVELABLE ET SON PROCEDE DE FABRICATION,Alkane|Carburetor|Jet fuel|Materials science|Aviation fuel|Physics|PARAFFIN HYDROCARBONS|Chemical engineering,Liquid carbonaceous fuels|Liquid hydrocarbon mixture production|Hydrocarbon oils refining|Azeotropic/extractive distillation|Hydrocarbon oils treatment products,TOTALENERGIES ONETECH,2024,2
205,CN117987169A,Method for producing biomass liquefied gas from biomass raw material,Hydrogenation reaction|Process engineering|Reaction zone|Hydrogen treatment|Liquid gas|Butane|Propane|Continuous reaction|Raw material|Chemical engineering|Biomass feedstock,Molecular sieve catalysts|Liquid hydrocarbon mixture production|Treatment with hydrotreatment processes|Bio-feedstock,CHINA PETROLEUM & CHEMICAL CORP | SINOPEC RES INST OF PETROLEUM PROCESSING CO LTD,2024,2
206,TW202449126A,Process for the one-step hydrotreatment and hydroisomerization of plant oils using at least one sulfide catalyst with an isomerizing zeolite,Fixed bed|Process engineering|Sulfide compound|Organic chemistry|Zeolite|Chemical engineering,Liquid carbonaceous fuels|Liquid hydrocarbon mixture production|Refining to eliminate hetero atoms,IFP ENERGIES NOUVELLES,2024,2
207,CN118076713A,Process for production of kerosene and diesel from renewable resources,Naphtha|Kerosene|Process engineering|Environmental engineering|Renewable resource|Waste management,Liquid hydrocarbon mixture production|Effluent separation|Gasoline stabilisation,SHELL INTERNATIONALE RESEARCH MAATSCHAPPIJ BV,2024,2
209,IN202417011860A,Process for producing kerosene and diesel from renewable sources,Naphtha|Kerosene|Environmental engineering|Hydrogen treatment|Bulk water|Waste management|Water resource management,Liquid hydrocarbon mixture production|Effluent separation|Gasoline stabilisation,SHELL INTERNATIONALE RESEARCH MAATSCHAPPIJ BV,2024,2
210,CN117940536A,Process for production of kerosene and diesel from renewable resources,Naphtha|Process engineering|Environmental engineering|Waste management,Hydrocarbon distillation|Liquid hydrocarbon mixture production|Bio-feedstock|Effluent separation,SHELL INTERNATIONALE RESEARCH MAATSCHAPPIJ BV,2024,2
215,CN118475670A,Middle distillate fuels from organic materials of biological origin,Alkane|Environmental engineering|Cycloalkane|Tall oil|Waste management|PARAFFIN HYDROCARBONS|Cetane number|Pitch,Refining to change hydrocarbon structural skeleton|Liquid carbonaceous fuels|Liquid hydrocarbon mixture production|Treatment with hydrotreatment processes|Refining to eliminate hetero atoms,NESTE OYJ,2024,2
216,CN116948673B,一种生产低芳烃溶剂油的装置和加氢方法,Aromatic solvent|Fluid phase|Hydrodeoxygenation|Process engineering|Aromatic hydrocarbon|Cracking reaction|Chemical engineering,Liquid hydrocarbon mixture production|Treatment with hydrotreatment processes|Bio-feedstock|Hydrocarbon oils treatment products,CHINA PETROLEUM & CHEMICAL CORP | SINOPEC (DALIAN) PETROCHEMICAL RES INST CO LTD,2024,2
217,IN202317012596A,Direct single phase immersion coolant liquid,Alkane|Process engineering|Cooling fluid|Chemistry|PARAFFIN HYDROCARBONS|Coolant,Semiconductor/solid-state device details|Solid-state devices|Heat-exchange elements|Semiconductor devices,NESTE OYJ,2024,2
218,CN117987182A,Method for producing biomass low-carbon alkane from biomass raw material,Alkane|Hydrogenation reaction|Reaction zone|Hydrogen treatment|Propane|Continuous reaction|Biomass|Methane|Raw material|Cracking|Chemical engineering|Biomass feedstock,Treatment with hydrotreatment processes,CHINA PETROLEUM & CHEMICAL CORP | SINOPEC RES INST OF PETROLEUM PROCESSING CO LTD,2024,2
219,BR112024025618A2,MÉTODO E SISTEMA PARA TRATAR MATÉRIAS-PRIMAS RENOVÁVEIS,-,Liquid hydrocarbon mixture production|Treatment with hydrotreatment processes|Non-miscible liquid separation,DUKE TECH LLC,2025,2
223,JP2025514530A,脂質補助転化,Cellulose|Hydrocotyle bowlesioides|Gasoline|Environmental engineering|Lignocellulosic biomass|Perylene derivatives|Deoxygenation|Hydrolysis|Phenol Compound|Raw material,Hydrocarbon distillation|Liquid carbonaceous fuels|Liquid hydrocarbon mixture production|Bio-feedstock|Hydrocarbon oils treatment products,RENEWABLE ENERGY GRP INC,2025,2
224,IN399830B,An improved process to produce aromathics rich aviation fuel along with other c1-c24 hydrocarbons,Ptru catalyst|Hydrocotyle bowlesioides|Kerosene|Oxocarbon|Process engineering|Carbon oxide|Hydrogen treatment|Renewable resource|Aromatic hydrocarbon|Aviation fuel|Environmental geology|Conversion reaction,Organic chemistry,COUNCIL OF SCI & IND RES,2022,2
225,IL253687B,Hydrothermal cleanup process,-,Refining by heating/cooling|Distillation purification/separation|Refining by water treatment|Distillation separation|Liquid solutions solvent extraction|Bio-feedstock|Non-miscible liquid separation,APPLIED RESEARCH ASSOCIATES INC,2024,2
226,IN202517035232A,Method for manufacture of a biomass based diesel from feedstock from olefin oligomers,Biofuel|Dehydrogenation|Cloud point|Environmental geology|Propene|Oligomer|Hydrodeoxygenation|Process engineering|Alkene|Propane|Bio based|Cetane number|Mixed fuel,Refining to change hydrocarbon structural skeleton|Hydrocarbon from oxygen organic compounds|Liquid carbonaceous fuels|Liquid hydrocarbon mixture production|Treatment with hydrotreatment processes,RENEWABLE ENERGY GRP INC,2025,2
227,BR112024006946A2,BLENDAS DE BIOCOMBUSTÍVEIS COM ESTABILIDADE À OXIDAÇÃO E LUBRICIDADE APRIMORADAS,-,Liquid carbonaceous fuels|Liquid hydrocarbon mixture production|Special form destructive distillation,SHELL INTERNATIONALE RESEARCH MAATSCHAPPIJ BV,2024,2
228,IN202217075880A,Method for selective decarboxylation of oxygenates,Alkane|Hydrocarbon mixtures|Side chain|Oxygen compound|Deoxygenation|PARAFFIN HYDROCARBONS|Carbon atom|Fatty acid ester|Chemical engineering|Hydrodeoxygenation|Carbon oxide|Decarboxylation|Process plant|Aviation fuel,Hydrocarbon oil cracking|Liquid hydrocarbon mixture production|Refining by selective hydrogenation,TOPSOE AS,2024,2
232,CN116554926B,一种废弃油脂加氢生产生物柴油的方法,Oil and grease|Liquid product|Biodiesel|Ptru catalyst|Waste oil|Slurry|Hydrogen treatment|Oxygen compound|Chemistry|Raw material|Hydrocyclone|Fluid phase|Hydrogenation reaction|Process engineering|Effluent,Biofuels|Treatment with hydrotreatment processes,CHINA UNIV OF PETROLEUM (EAST CHINA),2024,2
233,CN118374298A,Preparation method and device of biological aviation kerosene,Oil and grease|Ptru catalyst|Isomerization|Hydrodeoxygenation|Process engineering|Waste recycling|Dehydration|Aviation fuel|Aviation kerosene|Environmental geology,Treatment with hydrotreatment processes,EAST CHINA UNIV OF SCI & TECH | SINOPEC LUOYANG PETROCHEM ENG CORP | SINOPEC ENG GRP CO LTD,2024,2
234,FR3153350A1,Composition de base paraffinique pour carburéacteur renouvelable et procédé de production de base paraffinique renouvelable à rendement élévé,-,Liquid carbonaceous fuels|Liquid hydrocarbon mixture production|Hydrocarbon oils treatment products,TOTALENERGIES ONETECH,2025,2
235,CN117987179A,Method for producing biodiesel through combination of tubular reactor and fixed bed reactor,Biodiesel|Ptru catalyst|Biofuel|Fixed bed|Liquid hydrocarbons|Process engineering|Hydrogen treatment|Chemistry|Effluent|Tube reactor|Chemical engineering,Biofuels|Treatment with hydrotreatment processes|Bio-feedstock|Chemical/physical processes,CHINA PETROLEUM & CHEMICAL CORP | SINOPEC RES INST OF PETROLEUM PROCESSING CO LTD,2024,2
236,CN116024003B,一种油脂类原料加氢制备喷气燃料组分的方法,-,Treatment with hydrotreatment processes|Bio-feedstock,CHINA PETROLEUM & CHEMICAL CORP | RES INST OF PETROLEUM PROCESSING SINOPEC,2025,2
239,WO2025083367A1,Method for treating by-products resulting from the production of synthetic fuels and production unit for implementing same,Biofuel|Process engineering|Synthetic fuel|Chemistry|Refinery|Biogas,Bioreactor/fermenter combinations|Treatment using aerobic processes|Biological substance pretreatments|Refining to change hydrocarbon structural skeleton|Biochemistry cleaning apparatus|Treatment with anaerobic digestion processes|Biomass after-treatment|Liquid hydrocarbon mixture production|Treatment with hydrotreatment processes|Enzymology/microbiology apparatus|Fermentation|Liquid separation|Specific use bioreactors/fermenters|Water/sewage treatment by oxidation|Fatty/oily/floating substances removal devices|Multistage water/sewage treatment|Nature of treatment water|Biological sludge treatment,VEOLIA ENVIRONNEMENT,2025,2
240,IN388197B,A catalytic process to convert renewable feedstock into aromoatics rich aviation fuel,Triglyceride|Process engineering|Hydrogen treatment|Fatty acid|Aviation fuel|Environmental geology,-,COUNCIL OF SCI & IND RES,2022,2
241,CN119522264A,Use of blends of waste plastics and biological feeds for chemical preparation,Chemical preparation|Polypropylene|Alkene|Materials science|Waste management|Environmental geology|Polyethylene|Chemical production|Polymer blend,Products|Catalytic cracking|Reagents|Educts|Plastic recycling|Liquid hydrocarbon mixture production|Treatment with hydrotreatment processes|Special form destructive distillation|Hydrocarbon by depolymerisation,CHEVRON USA INC,2025,2
242,WO2025133068A1,Process for hydrolytic pretreatment of a natural-origin hydrocarbon feedstock mixed with a fossil-origin feedstock,-,-,TOTALENERGIES ONETECH,2025,2
245,IN375986B,A system for conversion of triacylglyceride s-containing oils,Alkane|Cycloparaffins|Triglyceride|Process engineering|Alkene|Organic chemistry|PARAFFIN HYDROCARBONS|Chemical engineering|Crude oil,Liquid hydrocarbon mixture production|Treatment with hydrotreatment processes,LUMMUS TECHNOLOGY INC,2021,2
247,BR112021019843B1,MÉTODO E CARGA DE ALIMENTAÇÃO PARA PRODUZIR HIDROCARBONETOS,-,Liquid hydrocarbon mixture production|Treatment with hydrotreatment processes,NESTE OYJ,2024,2
