Number,Publication Number,Title,Technology topic,Application domain,Standardized Current Assignee,Publication Year,Cluster
268,KR102634020B1,가스화 가스로부터 모노사이클릭 방향족 화합물의 제조 및 단리,Ptru catalyst|Unsaturated hydrocarbon|Environmental engineering|Ethylene|Waste management,Hydrogen|Molecular sieve catalyst|Dispersed particle separation|Catalysts|Hydrocarbons|Chemical/physical/physico-chemical stationary reactors|Hydrocarbon by hydrocarbon condensation|Hydrogen/synthetic gas production|Extraction purification/separation|Absorption purification/separation|Hydrocarbon by hydrocarbon cracking,NEDERLANDSE ORG VOOR TOEGEPAST NATUURWETENSCHAPPELIJK ONDERZOEK TNO,2024,1
277,CN118142582A,Synthetic method for preparing biological fuel oil catalyst based on covalent organic framework (COFs) porous extensible structure and application,Biodiesel|Ptru catalyst|Emulsion|Ionic liquid|Copolymer|Materials science|Polyacrylonitrile|Covalent organic framework,Fatty acid esterification|Organic-compounds/hydrides/coordination-complexes catalysts|Catalyst activation/preparation|Liquid carbonaceous fuels|Metal/metal-oxides/metal-hydroxide catalysts,HEFEI FEIMU BIOTECHNOLOGY CO LTD,2024,1
278,CN111215073B,镍硅复合氧化物、其制备方法、包含该氧化物的催化剂及其应用,Ptru catalyst|Physical chemistry|Composite oxide|Materials science|Nickel|Chemical engineering|Inorganic chemistry,Organic chemistry|Heterogenous catalyst chemical elements|Metal/metal-oxides/metal-hydroxide catalysts,CHINA PETROLEUM & CHEMICAL CORP | RES INST OF PETROLEUM PROCESSING SINOPEC | EAST CHINA UNIV OF SCI & TECH,2024,1
293,CN116408056B,蒙脱土载体及其制备方法、加氢脱氧催化剂的制备方法及其应用,Ptru catalyst|Hydrodeoxygenation|Montmorillonite|Cross linker|High activity|Materials science|Acidifying agents,Fatty acid hydrogenation|Catalyst carriers|Biofuels|Heterogenous catalyst chemical elements|Liquid carbonaceous fuels|Metal/metal-oxides/metal-hydroxide catalysts,PETROCHINA CO LTD,2024,1
302,CN119368224A,Integral metal fiber and hollow hierarchical pore HZSM-5 molecular sieve core-shell structure catalyst as well as preparation method and application of integral metal fiber and hollow hierarchical pore HZSM-5 molecular sieve core-shell structure catalyst,Liquid product|Molecular sieve|Ptru catalyst|Physical chemistry|Metal fibers|Aromatic hydrocarbon|Catalytic efficiency|Inorganic chemistry|Large pore,Molecular sieve catalysts|Catalyst activation/preparation|Liquid hydrocarbon mixture production,HENAN UNIVERSITY OF TECHNOLOGY,2025,1
315,MX2021009548A,Heterogeneous catalyst with multi-catalytic activity.,Chemical industry|Ptru catalyst|Chemical reaction|Mesoporous silica|Hydrogen treatment|Ionic liquid|Chemical conversion|Polymerization|Chemical engineering|Heavy crude oil|Oxidizing agent|Polyoxometalate|Tungstic acid|Heterogeneous catalysis,Organic-compounds/hydrides/coordination-complexes catalysts|Catalyst activation/preparation|Catalytic reactions,INST MEXICANO DEL GASOLINEEO | UNIV DE GUANAJUATO,2023,1
2,US11993752B1,Process for manufacturing of renewable hydrocarbons from renewable feedstock comprising phosphorus as an impurity,Ptru catalyst|Hydrocotyle bowlesioides|Process engineering|Hydrogen treatment|Lipophilicity|Chemistry|Waste management|Catalytic hydrogenation|Manufacturing engineering,Treatment with hydrotreatment processes|Hydrocarbon oils refining,NESTE OYJ,2024,2
3,US20210269722A1,Production of hydrocarbons from recycled or renewable organic material,Ptru catalyst|Hydrocotyle bowlesioides|Environmental engineering|Hydrogen treatment|Phenol|Purified water|Hydrogen compounds|Waste management|Phenols,Thermal non-catalytic cracking|Catalytic cracking|Refining to change hydrocarbon structural skeleton|Hydrocarbon oil cracking|Liquid hydrocarbon mixture production|Bio-feedstock|Hydrocarbon oils treatment,NESTE OYJ,2021,2
4,US20250109342A1,Hydrocarbons and process for producing hydrocarbons from organic material of biological origin,-,Hydrocarbon distillation|Liquid carbonaceous fuels|Liquid hydrocarbon mixture production|Hydrocarbon oil cracking|Treatment with hydrotreatment processes|Bio-feedstock|Hydrocarbon oils refining|Hydrocarbon oils treatment products,NESTE OYJ,2025,2
5,US12331254B2,Method for producing renewable fuels,Process engineering|Marine fuel|Waste management|Renewable fuels|Environmental geology,Refining to change hydrocarbon structural skeleton|Hydrocarbon distillation|Liquid carbonaceous fuels|Liquid hydrocarbon mixture production|Treatment with hydrotreatment processes|Base-materials|Hydrocarbon oils treatment products,NESTE OYJ,2025,2
6,EP4437064A1,Integrated process for the manufacture of renewable diesel,-,Refining to change hydrocarbon structural skeleton|Biofuels|Liquid hydrocarbon mixture production|Bio-feedstock|Hydrocarbon oils treatment products|Refining to eliminate hetero atoms,EXXONMOBIL TECHNOLOGY & ENGINEERING CO,2024,2
7,US20240286982A1,Process and plant for producing methane or methanol from a solid renewable feedstock,Steam reforming|Solid carbon|Electrolysis|Methanation|Deoxygenation|Glycol synthesis|Methanol|Environmental geology|Oxygen gas|Syngas|Thermodynamics|Hydrodeoxygenation|Process engineering|Hydrothermal liquefaction|Alkene|Pyrolysis|Thermal decomposition,Electrolysis components|Direct heating destructive distillation|Hydroxy compound preparation|Liquid hydrocarbon mixture production|Pyrolysis reactions|Hydrogen/synthetic gas production|Bio-feedstock|Hydrogen|Hydrocarbon from carbon oxides|Organic compound preparation|Gaseous fuels|Gasification processes details|Hydrocarbons|Liquid carbonaceous fuels|Chemical/physical/physico-chemical stationary reactors|Special form destructive distillation|Combustible gas production,TOPSOE AS,2024,2
8,EP4540340A1,Systems and methods for renewable fuels,-,Hydrocarbon oil cracking|Liquid hydrocarbon mixture production|Treatment with hydrotreatment processes|Bio-feedstock|Hydrocarbon oils refining|Effluent separation|Hydrocarbon oils treatment products,EXXONMOBIL TECHNOLOGY & ENGINEERING CO,2025,2
9,US20240417350A1,Processes for the integration of hydrolysis of renewable glycerides with the generation of paraffins and propylene glycol,Alkane|Hydrogen treatment|Glyceroneogenesis|Hydrolysis|Transport fuel|Propylene glycol|Materials science|Glyceride|PARAFFIN HYDROCARBONS|Hydrogenolysis|Chemical engineering|Isopropylene glycol,Hydrocarbon by isomerisation|Organic compound preparation|Refining to change hydrocarbon structural skeleton|Liquid hydrocarbon mixture production|Hydrocarbons|Chemical/physical/physico-chemical stationary reactors|Bio-feedstock|Preparation by hydrolysis|Hydrocarbon oils treatment,AYAS RENEWABLES INC,2024,2
10,WO2025133470A1,A process for producing hydrocarbon fractions having sustainable content and hydrocarbon fractions obtainable by said process,-,-,NESTE OYJ,2025,2
13,SG11202501885XA,A process for producing an aviation fuel component,-,Liquid hydrocarbon mixture production|Treatment with hydrotreatment processes,NESTE OYJ,2025,2
16,WO2025103834A1,Producing renewable hydrocarbons and chemical products from biomass,Environmental engineering|Chemical products|Biomass|Environmental protection|Waste management,Thermal non-catalytic cracking|Refining to change hydrocarbon structural skeleton|Liquid hydrocarbon mixture production|Treatment with hydrotreatment processes|Hydrocarbon oils treatment products,BASF SE,2025,2
17,US20250136878A1,Process for producing kerosene from renewable sources,Liquid product|Hydrocotyle bowlesioides|Kerosene|Wastewater|Process engineering|Hydro power|Separation system|Hydrogen compounds|Product recovery,Hydrocarbon distillation|Liquid hydrocarbon mixture production|Treatment with hydrotreatment processes|Bio-feedstock|Hydrocarbon oils treatment products,SHELL USA INC,2025,2
18,EP4021846A4,Method for producing fuel using renewable methane,-,Hydrogen separation using solid contact|Hydrocarbon oils treatment control/regulation|Gaseous fuels|Biofuels|Hydrocarbon oil cracking|Hydrogen production|Liquid carbonaceous fuels|Bio-feedstock|Hydrogen/synthetic gas production|Hydrocarbon oils refining|Hydrocarbon oils treatment products,IOGEN CORPORATION,2023,2
19,WO2025051706A1,Producing renewable hydrocarbons from biomass,-,-,BASF SE,2025,2
21,AU2023410401A1,Process for producing renewable hydrocarbons from renewable feedstock comprising phosphorus as impurity,-,-,NESTE OYJ,2025,2
22,AU2019363697B2,Method for co-production of aviation fuel and diesel,Kerosene|Hydrodeoxygenation|Diluent|Process engineering|Jet fuel|Aviation fuel|Process plant|Intermediate product|Liquid fraction|Chemical engineering,Refining to change hydrocarbon structural skeleton|Liquid carbonaceous fuels|Liquid hydrocarbon mixture production|Hydrocarbon oil cracking|Treatment with hydrotreatment processes|Bio-feedstock|Refining by aromatic hydrocarbon hydrogenation|Hydrocarbon oils treatment products,HALDOR TOPSOE AS,2025,2
23,EP4022013A4,Method for producing a fuel using renewable hydrogen,-,Hydrogen|Hydrocarbon oils treatment control/regulation|Gaseous fuels|Biofuels|Liquid carbonaceous fuels|Bio-feedstock|Hydrogen/synthetic gas production|Hydrocarbon oils refining|Hydrocarbon oils treatment products,IOGEN CORPORATION,2023,2
27,US20240417634A1,"A method for producing renewable gas, renewable naphtha, and renewable jet fuel",Thermodynamics|Naphtha|Ptru catalyst|Hydrodeoxygenation|Process engineering|Jet fuel|Environmental geology,Molecular sieve catalysts|Refining to change hydrocarbon structural skeleton|Liquid carbonaceous fuels|Liquid hydrocarbon mixture production|Treatment with hydrotreatment processes|Bio-feedstock|Refining to eliminate hetero atoms,NESTE OYJ,2024,2
28,SG11202005520YB,Preparation of an aviation fuel composition,-,Thermal non-catalytic cracking|Catalytic cracking|Liquid carbonaceous fuels|Liquid hydrocarbon mixture production|Treatment with hydrotreatment processes|Hydrocarbon oils refining,NESTE OYJ,2023,2
31,SG11202205376UB,Flexible integrated production plant system and method,-,Liquid hydrocarbon mixture production|Liquid carbonaceous fuels,NESTE OYJ,2025,2
32,US20250136881A1,Renewable jet-fuel composition,Benzene|Biofuel|Process engineering|Fatty acid|Cycloalkane|Jet fuel|Chemical engineering,Liquid carbonaceous fuels|Liquid hydrocarbon mixture production|Treatment with hydrotreatment processes|Bio-feedstock|Hydrocarbon oils treatment products,TOTALENERGIES ONETECH,2025,2
33,US20250188371A1,Process for producing kerosene and diesel from renewable sources,Naphtha|Kerosene|Process engineering|Environmental engineering|Waste management,Hydrocarbon distillation|Liquid hydrocarbon mixture production|Treatment with hydrotreatment processes|Bio-feedstock|Effluent separation|Hydrocarbon oils treatment products,SHELL USA INC,2025,2
36,US20250163337A1,Enhanced Treatment of Renewable Feedstocks with Integrated Off-Gas Processing,Process engineering|Waste management|Heat exchanger|Environmental geology,Liquid degasification with auxillary substances|Liquid hydrocarbon mixture production|Treatment with hydrotreatment processes|Non-miscible liquid separation|Hydrocarbon oils treatment products,DUKE TECH LLC,2025,2
37,US12203037B2,System for treating renewable feedstocks with integrated hydroprocessing,Liquid hydrocarbons|Process engineering|Hydrogen treatment|Waste management|Heat exchanger|Environmental geology|Thermal source,Liquid degasification with auxillary substances|Liquid hydrocarbon mixture production|Treatment with hydrotreatment processes|Bio-feedstock|Non-miscible liquid separation|Fractional distillation|Hydrocarbon oils treatment products,DUKE TECH LLC,2025,2
41,EP4085118A4,Production of renewable crude oil,-,Hydrocarbon distillation|Liquid carbonaceous fuels|Liquid hydrocarbon mixture production|Treatment with hydrotreatment processes|Bio-feedstock|Naphtha treatment|Hydrocarbon oils treatment products,VALERO SERVICES INC,2024,2
42,WO2025101467A1,Process for producing fuel and/or chemicals from renewable sources,Hydrodeoxygenation|Process engineering|Organic chemistry|Chemical engineering,Thermal non-catalytic cracking|Liquid hydrocarbon mixture production|Treatment with hydrotreatment processes,SHELL USA INC | SHELL INTERNATIONALE RESEARCH MAATSCHAPPIJ BV,2025,2
43,US12187965B2,Process for integrated production of renewable fuels and chemicals,Glycerol|Triglyceride|Process engineering|Hydrogen treatment|Base oil|Fatty acid|Diesel fuel|Aviation fuel|PARAFFIN HYDROCARBONS|Renewable fuels|Environmental geology,Fatty acid hydrogenation|Fatty acids production/refining|Liquid hydrocarbon mixture production|Preparation by OH group elimination|Treatment with hydrotreatment processes|Bio-feedstock|Hydrocarbon oils refining|Base-materials|Vacuum distillation|Preparation by hydrolysis|Hydrocarbon oils treatment products|Organic compound preparation|Efficient propulsion technologies|Liquid carbonaceous fuels|Carboxylic compound separation/purification,NESTE OYJ,2025,2
44,US11525096B2,Method for treating renewable feedstocks,Monoglyceride|Sterol|Ptru catalyst|Phospholipid|Hydrogen treatment|Fatty alcohol|Tocotrienol|Oxygen gas|Naphtha|Triglyceride|Environmental engineering|Diglyceride|Waste management|Phenols,Liquid degasification with auxillary substances|Liquid hydrocarbon mixture production|Treatment with hydrotreatment processes|Non-miscible liquid separation|Hydrocarbon oils treatment products,DUKE TECH LLC,2022,2
46,AU2022271829B2,Process for hydroprocessing materials from renewable sources,Reactor system|Hydrodeoxygenation|Process engineering|Hydrodenitrogenation|Waste management|Environmental geology|Chemical engineering,Liquid hydrocarbon mixture production|Membrane filters|Hydrocarbon oil cracking|Loose filtering material filters|Bed hydrotreatment processes apparatus|Bio-feedstock|Hydrocarbon oils refining|Gravity filters|Chemical/physical processes|Stationary filtering element filters,SHELL INTERNATIONALE RESEARCH MAATSCHAPPIJ BV,2025,2
48,US12180426B2,Process for treating offgas from hydrotreating of renewable feedstocks,Exhaust fumes|Hydrogen treatment|Co carbon monoxide|Effluent|Hydrogen sulphide|Environmental chemistry,Products|Gas treatment|Reagents|Educts|Dispersed particle separation|Liquid hydrocarbon mixture production|Bio-feedstock|Gas contaminants removal|Air quality improvement|Hydrocarbon oils treatment,SHELL USA INC,2024,2
49,US12281272B2,Production of renewable fuels,Gasoline|Process engineering|Environmental protection|Renewable fuels|Transportation fuel,Catalytic cracking|Efficient propulsion technologies|Liquid carbonaceous fuels|Liquid hydrocarbon mixture production|Treatment with hydrotreatment processes|Bio-feedstock|Hydrocarbon oils refining|Hydrocarbon oils treatment products,VALERO SERVICES INC,2025,2
51,EP4547784A1,Process for producing kerosene and/or diesel from renewable sources,-,Refining to change hydrocarbon structural skeleton|Hydrocarbon oil cracking|Liquid hydrocarbon mixture production|Treatment with hydrotreatment processes|Bio-feedstock|Hydrocarbon oils treatment products,SHELL INTERNATIONALE RESEARCH MAATSCHAPPIJ BV,2025,2
52,US20250027000A1,Intermediate and hydrotreated fuel compositions from renewable lipid feedstocks,Alkane|Reactor system|Ptru catalyst|Hydrogen treatment|Organic chemistry|Cyclic hydrocarbon|Renewable fuels|Chemical engineering,Fatty acid hydrogenation|Liquid carbonaceous fuels|Liquid hydrocarbon mixture production|Hydrocarbon oils treatment,CHEVRON USA INC,2025,2
53,US20240294444A1,A method and feed for producing ethylene,Propane|Ethylene|Chemistry|Effluent|Cracking|Chemical engineering,Thermal non-catalytic cracking|Hydrogen|Hydrocarbon oil cracking|Liquid hydrocarbon mixture production|Bio-feedstock|Hydrocarbon by hydrocarbon cracking|Hydrocarbon oils treatment products,NESTE OYJ,2024,2
54,WO2024175793A1,Method for processing liquefied material,Thermodynamics|Ptru catalyst|Fixed bed|Process engineering|Hydrogen treatment|Waste management|Thermo chemical,Liquid hydrocarbon mixture production|Treatment with hydrotreatment processes|Bed hydrotreatment processes apparatus|Refining by selective hydrogenation|Refining by aromatic hydrocarbon hydrogenation,TOPSOE AS,2024,2
55,US12037552B2,Co-processing of renewable jet and diesel,Co-processing|Diesel fuel|Coal oil|Cracking|Environmental geology|Chemical engineering|Crude oil,Biofuels|Hydrocarbon distillation|Liquid hydrocarbon mixture production|Treatment with hydrotreatment processes|Bio-feedstock|Hydrocarbon oils treatment products,EXXONMOBIL TECHNOLOGY & ENGINEERING CO,2024,2
56,US20240263083A1,A system and a method for storing biological feedstock,Sludge|Process engineering|Sewage|Biological organism|Storage tank|Biomaterial,Waste water treatment from animal processing|Liquid hydrocarbon mixture production|Bio-feedstock|Liquid separation|Hydrocarbon oils treatment|Water treatment parameter control|Sludge treatment by de-watering/drying/thickening|Fatty/oily/floating substances removal devices|Sludge treatment by thermal conditioning|Specific water treatment objectives|Multistage water/sewage treatment|Waste water treatment from food industry|Treatment involving sedimentation,NESTE OYJ,2024,2
59,US12060529B2,Marine fuel blend,Process engineering|Hydrogen treatment|Marine fuel|Pour point|Environmentally friendly|Waste management|Environmental geology|Mixed fuel,Refining to change hydrocarbon structural skeleton|Biofuels|Liquid hydrocarbon mixture production|Liquid carbonaceous fuels|Bio-feedstock|Hydrocarbon oils treatment,NESTE OYJ,2024,2
60,WO2025090797A1,High diesel selectivity during manufacture of renewable diesel,Hydrodeoxygenation|Process engineering|Diesel fuel|Environmental geology,Liquid hydrocarbon mixtures production|Liquid carbonaceous fuels|Liquid hydrocarbon mixture production|Bio-feedstock|Hydrocarbon oils refining|Hydrocarbon oils treatment products,CHEVRON USA INC,2025,2
61,WO2024224062A1,Decarbonisation of a hydrotreatment plant,Steam reforming|Process engineering|Hydrogen treatment|Industrial engineering|Decarburization|Treatment unit|Chemical plant|Exhaust gas|Environmental geology|Manufacturing engineering,Hydrogen separation using solid contact|Combustible gas catalytic treatment|Liquid hydrocarbon mixture production|Hydrogen/synthetic gas production|Hydrocarbon oils treatment|Refining to eliminate hetero atoms,JOHNSON MATTHEY PLC,2024,2
63,WO2024254330A1,Process to make a renewable product from biofeedstock,Ptru catalyst|Isomerization|Process engineering|Biology|Organic chemistry|Recycled products|Environmental geology,Molecular sieve catalysts|Liquid hydrocarbon mixture production|Treatment with hydrotreatment processes|Bio-feedstock|Hydrocarbon oils refining|Hydrocarbon oils treatment products,CHEVRON USA INC,2024,2
64,US12173239B2,High rate reactor system,Alkane|Kerosene|Components of crude oil|Alkylation|Organic component|PARAFFIN HYDROCARBONS|Chemical engineering|Naphtha|Reactor system|Process engineering|Thermal reaction|Conversion reaction|Octane,Hydrocarbon oil cracking|Chemical/physical/physico-chemical stationary reactors|Bio-feedstock|Supercritical condition processes|Refining to eliminate hetero atoms|Hydrocarbon oils treatment products,APPLIED RESEARCH ASSOCIATES INC,2024,2
66,US20250163338A1,"Conversion of Gums to Naphtha, Sustainable Jet Fuel, and Diesel Products",Thermodynamics|Naphtha|Petroleum engineering|Waste management,Liquid degasification with auxillary substances|Liquid hydrocarbon mixture production|Treatment with hydrotreatment processes|Non-miscible liquid separation|Hydrocarbon oils treatment products,DUKE TECH LLC,2025,2
69,US12297395B2,Biofuel blends,Cellulose|Biofuel|Engineering|Fatty acid|Food science|Environmental geology,Refining to change hydrocarbon structural skeleton|Liquid carbonaceous fuels|Liquid hydrocarbon mixture production|Bio-feedstock|Special form destructive distillation|Refining to eliminate hetero atoms|Hydrocarbon oils treatment products,SHELL USA INC,2025,2
71,US20250171697A1,Sustainable Diesel Production from Lignins,Sustainable production|Process engineering|Waste management|Environmental geology|Lignin,Liquid degasification with auxillary substances|Liquid hydrocarbon mixture production|Treatment with hydrotreatment processes|Non-miscible liquid separation|Hydrocarbon oils treatment products,DUKE TECH LLC,2025,2
72,WO2025072600A1,Catalytic decarboxylation/decarbonylation of oleaginous feeds including rosin acids to sustainable aviation fuel blendstock,-,Liquid hydrocarbon mixture production|Bio-feedstock|Hydrocarbon oils treatment,UNIVERSITY OF KENTUCKY RESEARCH FOUNDATION,2025,2
73,EP3696250B8,Conversion of naphtha to LPG in renewable hydroprocessing units,-,Hydrocarbon oil cracking|Liquid hydrocarbon mixture production|Treatment with hydrotreatment processes|Bio-feedstock|Hydrocarbon oils refining,TOPSOE AS,2022,2
75,WO2025038904A3,Reducing consumption of sulfiding agent in hydroprocessing of biofeedstocks,-,Gas treatment|Dispersed particle separation|Hydrocarbon oils treatment,EXXONMOBIL TECHNOLOGY & ENGINEERING CO,2025,2
76,WO2024165222A1,Low temperature stabilization of liquid oils,Nickel catalyst|Ptru catalyst|Fixed bed|Process engineering|Hydrogen treatment|Space velocity|Organic chemistry|Pyrolysis oil|Chemical engineering,Liquid hydrocarbon mixture production|Treatment with hydrotreatment processes|Bed hydrotreatment processes apparatus|Refining to eliminate hetero atoms,TOPSOE AS,2024,2
77,US12269997B2,Method for production of a transportation fuel,Hydrodeoxygenation|Oxygenate|Process engineering|Ammonia|Partial pressure|Chemistry|Waste management|Thermal reaction|Intermediate product|Chemical engineering|Transportation fuel,Liquid hydrocarbon mixture production|Treatment with hydrotreatment processes|Bio-feedstock,TOPSOE AS,2025,2
80,US12297391B2,Method of providing a bio-oil to a hydrodeoxygenation reactor,Physical chemistry|Hydrodeoxygenation|Diluent|Vapor phase|Liquid phase|Environmental geology|Chemical engineering,Biofuels|Liquid hydrocarbon mixture production|Bio-feedstock|Hydrocarbon oils treatment products,REG SYNTHETIC FUELS LLC,2025,2
82,WO2025093347A1,Process for hydrotreating feedstocks manufactured from biomass and/or plastic waste,Plastic waste|Process engineering|Environmental engineering|Chemistry|Pyrolysis oil,Liquid carbonaceous fuels|Liquid hydrocarbon mixture production|Material testing goods|Hydrogen isotopes|Hydrocarbon oils treatment|Refining to eliminate hetero atoms,BASF SE,2025,2
83,WO2025012467A1,Biodegradable hydrocarbon fluids as drilling fluids and their use,Alkane|Petroleum engineering|PARAFFIN HYDROCARBONS|Carbon atom|Drilling fluid|Biodegradation,Drilling composition,TOTALENERGIES ONETECH,2025,2
84,WO2025132136A1,Method for producing renewable kerosene by two-step hydroprocessing using a specific catalyst in the hydroconversion step with recycle of a heavy fraction,-,-,IFP ENERGIES NOUVELLES,2025,2
85,WO2025078717A1,A method for producing transportation fuels and components thereto,Ptru catalyst|Reaction temperature|Physical chemistry|Components of crude oil|Jet fuel|Diesel fuel|Liquid paraffin|Zeolite|Transportation fuel,Ferrierite aluminosilicate zeolite|Molecular sieve catalysts|Liquid carbonaceous fuels|Liquid hydrocarbon mixture production|Treatment with hydrotreatment processes|Hydrocarbon oils refining|Hydrocarbon oils treatment products,NESTE OYJ,2025,2
86,EP4558587A1,Hydroprocessing of bio-crude oil with vegetable and/or fatty material,-,Liquid hydrocarbon mixture production|Bio-feedstock|Hydrocarbon oils treatment,TOPSOE AS,2025,2
88,AU2022208423A9,Low temperature stabilization of liquid oils,Ptru catalyst|Physical chemistry|Hydrogen treatment|Space velocity|Molybdenum|Pyrolysis oil|Environmental geology|Chemical engineering,Liquid hydrocarbon mixture production|Treatment with hydrotreatment processes|Bio-feedstock|Special form destructive distillation|Hydrocarbon oils treatment products,TOPSOE AS,2024,2
90,CA2893320C,Method for mixing fluids,Mechanical engineering|Spiral flow|Two fluid,Flow mixers|Transportation and packaging|Mixer accessories|Bio-feedstock|Chemical/physical/physico-chemical processes|Feed devices|Liquid-liquid reaction processes,NESTE OYJ,2022,2
91,EP4324898A4,"Organic feedstock decomposition method, and method for manufacturing liquid fuel, solid fuel, or activated carbon using same",-,Products|Reagents|Carbon compounds|Educts|Hydrocarbon distillation|Solid fuels|Waste based fuel|Liquid hydrocarbon mixture production|Indirect heating destructive distillation|Special form destructive distillation|Gas purification by non-gaseous materials condensation|Hydrocarbon oils treatment products,REBO INT INC,2025,2
93,SG11202010658UB,"Process for hydrotreating a diesel fuel feedstock with a feedstock of natural occurring oil(s), hydrotreating unit for the implementation of the said process, and corresponding hydrorefining unit",-,Liquid hydrocarbon mixture production|Treatment with hydrotreatment processes|Refining to eliminate hetero atoms,TOTAL RES & TECH FELUY,2023,2
99,GB2630889B,Hydroprocessing of waste tyre pyrolysis oil with vegetable and/or fatty material,Vegetable oil|Environmental engineering|Hydrogen treatment|Biology|Waste tires|Waste management|Pyrolysis oil|Environmental chemistry|Crude oil,Liquid hydrocarbon mixture production|Bio-feedstock|Special form destructive distillation|Hydrocarbon oils treatment,TOPSOE AS,2025,2
104,EP4562115A1,Renewable jet fuel composition having a high content of naphthenic compounds,-,Liquid hydrocarbon mixture production|Hydrocarbon oils refining|Hydrocarbon oils treatment products,TOTALENERGIES ONETECH,2025,2
