Number,Publication Number,Title,Technology topic,Application domain,Standardized Current Assignee,Publication Year,Cluster
25,US12252663B2,Purification method for biological feedstock,-,Fatty oils/acids recovery from waste|Fatty acids production/refining|Fatty acid esterification|Fatty-oils/fats refining|Liquid hydrocarbon mixture production|Distillation separation|Treatment with hydrotreatment processes|Bio-feedstock|Fatty substance recovery|Fermentation|Chemical recycling,NESTE OYJ,2025,0
29,US20240350942A1,A method for decreasing feed impurities,Ptru catalyst|Isomerization|Environmental engineering|Waste management|Catalytic hydrogenation|Environmental chemistry,Fatty acid chemical modification|Component separation|Refining by heating/cooling|Fatty-oils/fats refining|Solid sorbent liquid separation|Liquid hydrocarbon mixture production|Fatty-oils/fats separation|Bio-feedstock|Refining by filtration,NESTE OYJ,2024,0
30,SG10201602749QB,Improved process for manufacture of liquid fuel components from renewable sources,-,Refining to change hydrocarbon structural skeleton|Fatty-oils/fats refining|Fatty-oils/fats separation|Liquid carbonaceous fuels|Liquid hydrocarbon mixture production|Refining with acid-containing liquids|Treatment with hydrotreatment processes|Refining to eliminate hetero atoms,NESTE OYJ,2022,0
39,WO2024196450A9,"Production of fuels from hydroprocessed esters and fatty acids, low carbon hydrogen, and carbon dioxide in an integrated HEFA and efuels plant",-,-,INFINIUM TECHNOLOGY LLC,2025,0
45,EP4374949B1,Coupling process for producing biodiesel from waste fog,-,Fatty oils/acids recovery from waste|Fatty acid esterification|Biofuels|Dispersed particle separation|Fatty-oils/fats refining|Liquid carbonaceous fuels|Liquid hydrocarbon mixture production|Treatment with hydrotreatment processes|Refining by filtration|Refining to eliminate hetero atoms|Hydrocarbon oils treatment products,FUZHOU UNIV,2025,0
47,US20250101322A1,Heat treatment with adsorption purification of organic material of biological origin,-,Fatty oils/acids recovery from waste|Fatty acid hydrogenation|Hydrocarbon distillation|Fatty-oils/fats refining|Treatment with plural serial refining stages|Liquid hydrocarbon mixture production|Treatment with hydrotreatment processes|Bio-feedstock|Refining by filtration|Chemical/physical/physico-chemical processes|Fatty substance recovery,NESTE OYJ,2025,0
62,US20240263082A1,A storage tank system and a method for reducing unwanted gas formation,Microorganism|Sludge|Filter system|Process engineering|Material transfer|Biological organism|Gas formation|Storage tank,Water treatment parameter control|Fatty/oily/floating substances removal devices|Sludge treatment|Refining to change hydrocarbon structural skeleton|Fatty-oils/fats refining|Liquid carbonaceous fuels|Liquid hydrocarbon mixture production|Liquid separation,NESTE OYJ,2024,0
67,US20250147001A1,Method for determining a parameter of a composition of natural origin for determining the most suitable treatment for the removal of heteroatoms from said composition,Heteroatom|Process engineering|Industrial engineering|Renewable fuels|Manufacturing engineering,Fatty acid hydrogenation|Fatty-oils/fats refining|Liquid hydrocarbon mixture production|Material testing goods,TOTALENERGIES ONETECH,2025,0
68,WO2025074030A1,Purification of a feedstock comprising lipids,Biotechnology|O-Phosphoric Acid|Carboxylic acid|Citric acid|Acid treatment|Chemical engineering|Mineral acid,Fatty oils/acids recovery from waste|Fatty acid hydrogenation|Fatty acid isomerisation|Fatty acids production/refining|Fatty-oils/fats refining|Liquid hydrocarbon mixture production,NESTE OYJ,2025,0
78,WO2025074039A1,Method for purifying lipids,Medicine|Chemical compound|Fatty acid|Biology|Impurity|Chemical engineering,Fatty oils/acids recovery from waste|Fatty substance recovery/refining|Fatty-oils/fats refining|Liquid hydrocarbon mixture production|Hydrocarbon oils treatment,NESTE OYJ,2025,0
98,WO2024223722A1,Fatty acid esterification pretreatment process,Trans esterification|Transesterification|Medicinal chemistry|De esterification|Fatty acid ester,Fatty acid esterification|Hydrolases|Biofuels|Fermentation|Non-miscible liquid separation,NOVOZYMES AS,2024,0
120,US20240352363A1,Tall diesel composition,Carboxylic acid|Environmental engineering|Components of crude oil|Tall oil|Saturated fatty acid|Waste management|Abietic acid|Unsaturated fatty acid,Fatty oils/acids recovery from waste|Biofuels|Fatty-oils/fats refining|Liquid carbonaceous fuels|Liquid hydrocarbon mixture production|Bio-feedstock|Fatty substance recovery|Fractional distillation|Hydrocarbon dewatering|Evaporators with vertical tubes,SUNPINE,2024,0
128,US20240376398A1,Process for pretreating vegetable oils or animal fats intended for processes of transformation into biofuels,Visbreaker|Vegetable oil|Emulsion|Biofuel|Physical separation|Animal fat|Metal contaminants|Heat processing|Effluent|Pollutant,Biofuels|Fatty-oils/fats refining|Bio-feedstock|Food science,ENI SPA,2024,0
141,EP4499791A2,"Process for removing organic chlorine from used cooking oils (UCO), animal and vegetable recovery fats (AVR), and pyrolysis oils (PO) derived from waste",-,Refining with metals|Fatty-oils/fats refining,TECHNOLOGY SRL,2025,0
150,AU2019412718B2,Apparatus and method for heat treating a feedstock comprising a lipid material,Thermodynamics|Process engineering|Heat treated|Chemistry|Waste management|Chemical substance,Fatty acids production/refining|Solvent extraction|Fatty-oils/fats refining|Chemical/physical/physico-chemical reactor details|Fractional distillation,NESTE OYJ,2025,0
164,BR112021001022B1,MÉTODO DE PURIFICAR UM MATERIAL ORGÂNICO RECICLADO OURENOVÁVEL E PROCESSO PARA PRODUZIR HIDROCARBONETOSRECICLADOS OU RENOVÁVEIS,-,Fatty oils/acids recovery from waste|Liquid hydrocarbon mixture production|Treatment with hydrotreatment processes,NESTE OYJ,2024,0
165,FI128911B2,Purification of recycled and renewable organic material,Sterol|Ptru catalyst|Sorbent|Physical chemistry|Environmental engineering|Hydrogen treatment|Waste management,Fatty oils/acids recovery from waste|Thermal non-catalytic cracking|Fatty acid hydrogenation|Catalytic cracking|Refining to change hydrocarbon structural skeleton|Fatty-oils/fats refining|Solid sorbent liquid separation|Liquid hydrocarbon mixture production|Bio-feedstock|Hydrocarbon oils treatment|Refining to eliminate hetero atoms|Hydrocarbon oil cracking|Fatty substance recovery,NESTE OYJ,2025,0
166,FI128115B2,Purification of recycled and renewable organic material,Ptru catalyst|Physical chemistry|Environmental engineering|Hydrogen treatment|Waste management,Fatty oils/acids recovery from waste|Thermal non-catalytic cracking|Fatty acid hydrogenation|Catalytic cracking|Fatty acid isomerisation|Refining to change hydrocarbon structural skeleton|Fatty-oils/fats refining|Liquid hydrocarbon mixture production|Treatment with hydrotreatment processes|Bio-feedstock|Refining to eliminate hetero atoms|Hydrocarbon oil cracking|Fatty substance recovery,NESTE OYJ,2024,0
186,BR112022006058B1,MÉTODO PARA APRIMORAR MATERIAL DE BASE BIOLÓGICA E MATERIAL APRIMORADO,-,Hydrogen separation|Dispersed particle separation|Fatty-oils/fats refining|Liquid hydrocarbon mixture production|Hydrocarbons|Treatment with hydrotreatment processes|Gaseous mixture working up|Treatment with polymerisation|Hydrocarbon preparation,NESTE OYJ,2024,0
208,MY207548A,Hydrothermal purification process,-,Fatty oils/acids recovery from waste|Refining by heating/cooling|Fatty-oils/fats refining|Refining by water treatment,APPLIED RESEARCH ASSOCIATES INC,2025,0
211,JP2025500863A,プロパンを含むガス状組成物を処理するための方法,Distillation|Propane|Methane|Environmental chemistry|Inorganic chemistry,Refining to change hydrocarbon structural skeleton|Hydrogen separation|Hydrocarbon distillation|Distillation purification/separation|Fatty-oils/fats refining|Fractional condensation purification/separation|Hydrocarbon from oxygen organic compounds|Liquid hydrocarbon mixture production|Hydrocarbons|Treatment with hydrotreatment processes|Fractional distillation,NESTE OYJ,2025,0
213,CN113462432B,废油加工的方法及废油加工撬装式模块化集成装置,Isomerization|Distillation|Filtration|Waste oil|Hydrogen treatment|Integrated devices|Environmental geology|Naphtha|Alcohol|Hydrogenation reaction|Process engineering|Base oil|Polluted environment,Fatty oils/acids recovery from waste|Fatty-oils/fats refining|Liquid hydrocarbon mixture production|Treatment with hydrotreatment processes|Lubricant composition,PUJIANG SIXINGTONG TECH DEV CO LTD,2023,0
231,ID202405633A,PROSES PEMULIHAN MINYAK BERKELANJUTAN DARI BAHAN PADAT LIMBAH BERMINYAK,Process engineering|Slurry|Residual oil|Petroleum oil|Chemistry|Waste management|Stockpile,Other chemical processes|Fatty-oils/fats refining|Treatment with hydrotreatment processes,DESMET USA INC,2024,0
238,CN119391486A,Method for preparing saturated grease and byproduct alkane through two-stage low-pressure hydrogenation,Alkane|Thermodynamics|Process engineering|Chemistry|Raw material|Grease|Chemical engineering,Fatty acid hydrogenation|Fatty acids production/refining|Fatty-oils/fats refining|Liquid carbonaceous fuels|Liquid hydrocarbon mixture production|Base-materials|Hydrocarbon oils treatment,QINGDAO INST OF BIOENERGY & BIOPROCESS TECH CHINESE ACADEMY OF SCI,2025,0
243,ES3000756T3,A method for treating lipid materials,Medicine|Thermal treatment|Organic chemistry|Materials science|Heat treated|Chemical engineering,Fatty oils/acids recovery from waste|Fatty acids production/refining|Biofuels|Fatty-oils/fats refining|Liquid hydrocarbon mixture production|Bio-feedstock|Fatty-oils/fats production,NESTE OYJ,2025,0
262,JP7365362B2,低価値で無駄な脂肪、油、およびグリースをグレードアップするための方法,-,Fatty oils/acids recovery from waste|Fatty acids production/refining|Fatty acid esterification|Fatty-oils/fats refining|Liquid hydrocarbon mixture production|Treatment with hydrotreatment processes|Bio-feedstock|Refining by filtration|Refining with non-metals|Treatment with plural serial refining stages|Liquid carbonaceous fuels|Fatty substance recovery|Refining with aqueous alkaline solutions,REG SYNTHETIC FUELS LLC,2023,0
284,AR105759B2,"MÉTODO PARA HIDROLIZAR, ROMPER O DISRUMPIR UNA COMPOSICIÓN QUE COMPRENDE FOSFOLÍPIDO",-,Fatty-oils/fats refining|Fermentation|Lyases,BUNGE OILS INC,2024,0
286,BR122022014388B1,PROCESSO PARA A PRODUÇÃO DE UM BIODIESEL PURIFICADO A PARTIR DE UMA MATÉRIA-PRIMA CONTENDO MATERIAL INSAPONIFICÁVEL,-,Mixing methods|Edible oils/fats,RENEWABLE ENERGY GRP INC,2025,0
298,CN117887518A,Organochlorine removal agent and method for removing organochlorine in waste grease by using organochlorine removal agent,Oil and grease|Cyclodextrin|Environmental engineering|Waste oil|Perylene derivatives|Diamine|Isopropanolol|Environmental chemistry,Fatty-oils/fats refining|Fatty substance recovery,CHINA PETROLEUM & CHEMICAL CORP | SINOPEC (DALIAN) PETROCHEMICAL RES INST CO LTD,2024,0
301,MY196614A,Fractionation of biomass-based material,Environmental engineering|Tall oil|Waste management|Pitch|Environmental chemistry|Evaporator,Fatty oils/acids recovery from waste|Thermal non-catalytic cracking|Fatty-oils/fats refining|Pulp by-products recovery|Liquid hydrocarbon mixture production|Fatty-oils/fats production|Natural resin purification|Gasoline stabilisation|Fractional distillation|Hydrocarbon dewatering|Hydrocarbon oils treatment|Evaporators with vertical tubes,NESTE OYJ,2023,0
304,FR3145936A1,Procédé de traitement d’une composition comprenant un mélange riche en acides gras,Saturated fatty acid ester|Medicinal chemistry|Pharmacology|Carbon atom,Fatty oils/acids recovery from waste|Fatty-oils/fats refining|Fatty-oils/fats separation|Liquid carbonaceous fuels|Fuel additives,TOTALENERGIES ONETECH,2024,0
314,CN118222134A,Oxidative polymerization dry offset printing ink composition and printed matter,Polymer science|Vegetable oil|Polymerization|Composite material|Fatty acid ester|Offset printing,Inks,DIC油墨株式会社,2024,0
316,IN479438B,Semi-biosynthetic production of fatty alcohols and fatty aldehydes,Unsaturated lipid|Microorganism|Fatty alcohol|Fatty aldehyde|Polymer|Biological organism|Biosynthetic product|Acetic Acid Esters|Molecular biology|Insect pheromones,Sugar derivatives|DNA/RNA fragmentation,PROVIVI INC,2023,0
1,US12312542B2,Method for reducing deactivation of a hydrotreatment catalyst,Ptru catalyst|Physical chemistry|Hydrogen treatment|Chemical engineering|Inorganic chemistry,Fatty acid hydrogenation|Refining to change hydrocarbon structural skeleton|Fatty-oils/fats refining|Liquid hydrocarbon mixture production|Bio-feedstock|Metal/metal-oxides/metal-hydroxide catalysts|Hydrocarbon oils treatment,NESTE OYJ,2025,1
11,US12269996B2,Method for producing renewable C3 hydrocarbons and renewable aromatic hydrocarbons,Ptru catalyst|Hydrocotyle bowlesioides|Hydrodeoxygenation|Aromatic hydrocarbon|Materials science|Zeolite|Cracking|Chemical engineering,Aluminosilicate zeolite type ZSM-12|Catalytic cracking|Molecular sieve catalysts|Liquid hydrocarbon mixture production|Treatment with hydrotreatment processes|Bio-feedstock|Metal/metal-oxides/metal-hydroxide catalysts|Hydrocarbon oils treatment products,NESTE OYJ,2025,1
12,US20240218260A1,Isomerization of biofeeds over base metal catalysts,Ptru catalyst|Isomerization|Deoxygenation|Organic chemistry|Photochemistry|Hydrogen consumption|Zeolite|Inorganic chemistry|Side product,Molecular sieve catalysts|Liquid hydrocarbon mixture production|Treatment with hydrotreatment processes|Hydrocarbon oils refining|Metal/metal-oxides/metal-hydroxide catalysts,EXXONMOBIL TECHNOLOGY & ENGINEERING CO,2024,1
14,US20250109341A1,A method for producing renewable c3-c8 hydrocarbons,-,Molecular sieve catalysts|Heterogenous catalyst chemical elements|Fatty-oils/fats refining|Liquid hydrocarbon mixture production|Hydrocarbon oil cracking|Treatment with hydrotreatment processes|Bio-feedstock|Crystalline aluminosilicate zeolites,NESTE OYJ,2025,1
20,WO2024134009A1,Catalyst composition with redox-active support for simultaneous oxygen and nitrogen removal,Alkane|Nitrogen removal|Ptru catalyst|Cerium(IV) oxide|Physical chemistry|Redox|Niobium pentoxide|PARAFFIN HYDROCARBONS|Chemical engineering,Fatty-oils/fats refining|Liquid hydrocarbon mixture production|Hydrocarbon oil cracking|Treatment with hydrotreatment processes|Bio-feedstock|Metal/metal-oxides/metal-hydroxide catalysts|Refining to eliminate hetero atoms,NESTE OYJ,2024,1
24,US20240417635A1,A method for producing renewable aviation fuel,Ptru catalyst|Isomerization|Hydrodeoxygenation|Mechanical engineering|Aviation fuel|Zeolite|Automotive engineering|Manufacturing engineering,Molecular sieve catalysts|Liquid carbonaceous fuels|Liquid hydrocarbon mixture production|Bio-feedstock|Metal/metal-oxides/metal-hydroxide catalysts|Hydrocarbon oils treatment|Refining to eliminate hetero atoms,NESTE OYJ,2024,1
26,US20250066676A1,Method for producing renewable aviation fuel,Ptru catalyst|Hydrodeoxygenation|Mechanical engineering|Aviation fuel|Automotive engineering|Noble metal|Manufacturing engineering,Molecular sieve catalysts|Liquid hydrocarbon mixture production|Bio-feedstock|Refining to eliminate hetero atoms|Hydrocarbon oils treatment products,NESTE OYJ,2025,1
35,US20240216898A1,Base metal isomerization catalysts,Ptru catalyst|Isomerization|Deoxygenation|Organic chemistry|Photochemistry|Hydrogen consumption|Zeolite|Inorganic chemistry|Side product,Molecular sieve catalysts|Catalyst activation/preparation|Liquid hydrocarbon mixture production|Hydrocarbon oils refining,EXXONMOBIL TECHNOLOGY & ENGINEERING CO,2024,1
58,WO2024188884A1,Method for processing liquefied materials,Thermodynamics|Ptru catalyst|Fixed bed|Hydrogen treatment|Petroleum engineering|Catalyst regeneration|Thermo chemical|Chemical engineering,Catalyst regeneration/reactivation|Liquid hydrocarbon mixture production|Metal/metal-oxides/metal-hydroxide catalysts,TOPSOE AS,2024,1
70,US20240218259A1,Reduced h2 consumption during deoxygenation,Ptru catalyst|Physical chemistry|Deoxygenation|Hydrogen consumption|Chemical engineering|Inorganic chemistry,Molecular sieve catalysts|Refining to change hydrocarbon structural skeleton|Liquid hydrocarbon mixture production|Treatment with hydrotreatment processes|Bio-feedstock|Metal/metal-oxides/metal-hydroxide catalysts|Hydrocarbon oils treatment products,EXXONMOBIL TECHNOLOGY & ENGINEERING CO,2024,1
95,US20240425764A1,Systems and processes for lipid feedstock treatment with moving bed reactor,Ptru catalyst|Fluidized bed|Flue gas|Process engineering|Moving bed|Fatty acid|Chemistry|Chemical engineering|Phencyclone,Catalyst regeneration/reactivation|Liquid carbonaceous fuels|Liquid hydrocarbon mixture production|Bio-feedstock|Metal/metal-oxides/metal-hydroxide catalysts|Hydrocarbon oils treatment products,CHEVRON USA INC,2024,1
97,CA3056537C,Hydrodeoxygenation process of vegetable oils for obtaining green diesel,Vegetable oil|Ptru catalyst|Hydrodeoxygenation|Engineering|Mesoporous material|Propane|Animal fat|Palm oil|Co carbon monoxide|Transition metal,Fatty acid hydrogenation|Biofuels|Hydrocarbon preparation catalysts|Catalysts|Efficient propulsion technologies|Hydrocarbon from oxygen organic compounds|Liquid carbonaceous fuels|Hydrocarbons|Liquid hydrocarbon mixture production|Bio-feedstock|Metal/metal-oxides/metal-hydroxide catalysts|Hydrocarbon oils treatment products,INST MEXICANO DEL GASOLINEEO,2023,1
119,US12264117B2,Catalytic process for the production of aromatic hydrocarbons from used cooking oil,-,Molecular sieve catalyst|Molecular sieve catalysts|Catalysts|Catalyst activation/preparation|Hydrocarbon from oxygen organic compounds|Hydrocarbons,COUNCIL OF SCI & IND RES,2025,1
123,WO2024110230A1,"Process for producing middle distillates by co-processing of mineral feedstock with a renewable feedstock comprising a series of catalysts, including a beta zeolite-based catalyst",Ptru catalyst|Process engineering|Hydrogen treatment|Hydrocarbon|Zeolite|Chemical engineering,Molecular sieve catalysts|Catalyst activation/preparation|Liquid hydrocarbon mixture production|Hydrocarbon oil cracking|Treatment with hydrotreatment processes|Hydrocarbon oils refining,IFP ENERGIES NOUVELLES,2024,1
139,WO2025008536A1,Production of propylene from glycerides,Ionic liquid|Glyceride|Reaction conditions|Chemical engineering|Propene,Organic-compounds/hydrides/coordination-complexes catalysts|Catalysts|Hydrocarbon preparation catalysts|Preparation from carboxylic acid esters/lactones|Hydrocarbons|Catalytic reactions|Hydrocarbon preparation,TOTALENERGIES ONETECH BELGIUM SA,2025,1
140,US12090466B2,Catalysts for the deoxygenation of esters of free fatty acids and triglycerides,Ptru catalyst|Hydrocotyle bowlesioides|Triglyceride|Fatty acid|Deoxygenation|Chemical engineering,Hydrocarbon preparation catalysts|Catalysts|Catalyst activation/preparation|Hydrocarbons|Metal/metal-oxides/metal-hydroxide catalysts|Hydrocarbon preparation,SBI BIOENERGY,2024,1
152,PH12020551965B1,Method for producing bio-jet fuel,Ptru catalyst|Isomerization|Hydrogen atmosphere|Reaction temperature|Triglyceride|Fatty acid|Deoxygenation|Reaction step|Chemical engineering|Crude oil,Molecular sieve catalysts|Refining to change hydrocarbon structural skeleton|Catalyst activation/preparation|Liquid hydrocarbon mixture production|Metal/metal-oxides/metal-hydroxide catalysts,HIBD LAB ASSOC | ENVIRONMENT ENERGY,2024,1
160,BR102020017281B1,CATALISADORES E PROCESSO SELETIVO PARA PRODUÇÃO DE COMBUSTÍVEIS DE AVIAÇÃO RENOVÁVEIS,-,Molecular sieve catalysts|Liquid carbonaceous fuels|Hydrocarbon oil cracking|Hydrocarbon oils refining|Metal/metal-oxides/metal-hydroxide catalysts,PETROLEO BRASILEIRO SA PETROBRAS,2025,1
162,HUE066285T2,"Process for the production of renewable base oil, diesel and naphtha",-,Refining to change hydrocarbon structural skeleton|Fatty acids production/refining|Biofuels|Liquid hydrocarbon mixture production|Treatment with hydrotreatment processes|Carbonyl compound preparation by condensation|Bio-feedstock|Base-materials|Hydrocarbon oils treatment products|Molecular sieve catalysts|Preparation by hydrogenolysis|Hydrocarbon from oxygen organic compounds|Liquid carbonaceous fuels|Distillation separation|Metal/metal-oxides/metal-hydroxide catalysts|Carboxylic compound separation/purification,NESTE OYJ,2024,1
170,AR120815B1,Proceso selectivo para la producción de combustibles y destilados parafínicos renovables de alto peso molecular y combustible producido,-,Fatty acid chemical modification|Preparation by ester-hydroxy reaction|Catalyst activation/preparation|Metal/metal-oxides/metal-hydroxide catalysts|Preparation by transesterification,PETROLEO BRASILEIRO SA PETROBRAS,2024,1
171,SA11389B1,Hydrotreatment of feedstock from renewable sources using catalysts with a high content of active phase,Ptru catalyst|Hydrocotyle bowlesioides|Environmental engineering|Active phase|Waste management|Fatty acid ester,Physical/chemical process catalysts|Copper compounds|Manganese compounds,ENI SPA,2022,1
177,CN119265420B,一种废SAPO-11分子筛异构加氢催化剂中金属铂的回收方法,Molecular sieve|Ptru catalyst|Physical chemistry|Materials science|Waste management|Platinum Metal|Chemical engineering,Molecular sieve catalysts|Process efficiency improvement,TIELING GUIXIN ENVIRONMENTAL PROTECTION TECH CO LTD,2025,1
191,IDP00202207480B,PENGGUNAAN KATALIS BERDASARKAN IZM-2 DENGAN KANDUNGAN LOGAM ALKALI RENDAH UNTUK ISOMERISASI STOK UMPAN PARAFINIK KE DISTILAT SEDANG,Alkane|Alkaline earth metal|Ptru catalyst|Physical chemistry|PARAFFIN HYDROCARBONS|Zeolite|Chemical engineering|Periodic table,Molecular sieve catalysts|Liquid hydrocarbon mixture production|Hydrocarbon oils refining|Metal/metal-oxides/metal-hydroxide catalysts,IFP ENERGIES NOUVELLES,2024,1
192,BR112024027470A2,PROCESSO DE HIDROCONVERSÃO PARA A PRODUÇÃO DE PRODUTOS RENOVÁVEIS A PARTIR DA BIOFEEDSTOCK,-,Molecular sieve catalysts|Liquid hydrocarbon mixture production|Hydrocarbon oils refining,CHEVRON USA INC,2025,1
196,IDP000102163B,METODE UNTUK PRODUKSI BAHAN BAKAR HIDROKARBON CAIR,Ptru catalyst|Hydrogenation reaction|Liquid hydrocarbons|Reaction step|Hydrogen flow|Cracking|Chemical engineering,Molecular sieve catalysts|Liquid hydrocarbon mixture production|Hydrocarbon oil cracking|Treatment with hydrotreatment processes|Hydrocarbon oils refining|Metal/metal-oxides/metal-hydroxide catalysts,REBO INT INC,2025,1
200,BR112024027466A2,CATALISADOR E PROCESSO PARA FAZER DIESEL RENOVÁVEL E COMBUSTÍVEL DE AVIAÇÃO SUSTENTÁVEL,-,Molecular sieve catalysts|Liquid hydrocarbon mixture production|Hydrocarbon oils refining,CHEVRON USA INC,2025,1
212,KR1020250031539A,Method for preparing sustainable aviation fuel,Ptru catalyst|Process engineering|Reagent|Aviation fuel|Zeolite|Chemical engineering,Molecular sieve catalysts|Liquid hydrocarbon mixture production|Hydrocarbon oil cracking|Treatment with hydrotreatment processes|Bio-feedstock|Hydrocarbon oils refining|Metal/metal-oxides/metal-hydroxide catalysts|Hydrocarbon oils treatment products,SK INNOVATION CO LTD,2025,1
214,CN119040041B,一种低凝生物柴油及其制备方法,-,Molecular sieve catalysts|Biofuels|Liquid carbonaceous fuels|Liquid hydrocarbon mixture production|Treatment with hydrotreatment processes|Crystalline aluminosilicate zeolites|Molecular-sieve compounds,SHANDONG HI TECH CHEM GROUP | SHANDONG YIYOU BIOENERGY CO LTD | SHANDONG YICHI ENERGY CO LTD,2025,1
222,ID2021PID01087A,METODE UNTUK MEMPRODUKSI BAHAN BAKAR BIO-JET,Ptru catalyst|Isomerization|Hydrogen atmosphere|Reaction temperature|Triglyceride|Process engineering|Fatty acid|Reaction step|Chemical engineering|Crude oil,Molecular sieve catalysts|Refining to change hydrocarbon structural skeleton|Catalyst activation/preparation|Liquid hydrocarbon mixture production|Metal/metal-oxides/metal-hydroxide catalysts,ENVIRONMENT ENERGY | HIBD LAB ASSOC,2021,1
244,PH12018502509B1,Method for producing hydrocarbon liquid fuel,Oil and grease|Ptru catalyst|Vulcanization|Liquid fuel|Process engineering|Components of crude oil|Petroleum oil|Aqueous medium|Raw material|Cracking|Chemical engineering,Molecular sieve catalysts|Heterogenous catalyst chemical elements|Catalyst activation/preparation|Liquid hydrocarbon mixture production|Hydrocarbon oil cracking|Bio-feedstock|Metal/metal-oxides/metal-hydroxide catalysts|Hydrocarbon oils treatment,REBO INT INC,2022,1
255,CN118440779B,一种生物油脂制备HVO的方法,Ptru catalyst|Hydrogenation reaction|Hydrogenation process|Fixed bed|Process engineering|Hydrophobe|Organic chemistry,Fatty acid hydrogenation|Liquid carbonaceous fuels|Bio-feedstock|Metal/metal-oxides/metal-hydroxide catalysts,LUOYANG HENGJIU BIOENERGY CO LTD | HENAN JUNHENG IND GRP BIOTECH CO LTD,2024,1
256,CN118853222A,Method for preparing jet fuel component through hydrogenation of chlorine-containing grease raw material,Oil and grease|Physical chemistry|Hydrogen treatment|Jet fuel|Raw material|Effluent|Chemical engineering,Molecular sieve catalysts|Liquid hydrocarbon mixture production|Hydrocarbon oil cracking|Treatment with hydrotreatment processes|Hydrocarbon oils refining|Metal/metal-oxides/metal-hydroxide catalysts,CHINA PETROLEUM & CHEMICAL CORP | SINOPEC RES INST OF PETROLEUM PROCESSING CO LTD,2024,1
258,CN117983291A,Catalyst for preparing alkane through grease hydrodeoxygenation-isomerization and preparation method and application thereof,Alkane|Molecular sieve|Ptru catalyst|Isomerization|Hydrodeoxygenation|Aluminium oxides|Materials science|SILICONE DIOXIDE|Reaction conditions|Oxide,Molecular sieve catalysts|Liquid hydrocarbon mixture production,NANJING KANG XIN CHENG BIOLOGICAL TECH CO LTD,2024,1
