Number,Publication Number,Title,Technology topic,Application domain,Standardized Current Assignee,Publication Year,Cluster
248,IN202417038519A,Process for upgrading an oxygenate feedstook into hydrocarbon fractions and other applications,Alkane|Hydrodeoxygenation|Process engineering|Oxygen compound|Jet fuel|Process plant|PARAFFIN HYDROCARBONS|Cracking|Chemical engineering,Hydrocarbon oil cracking|Liquid hydrocarbon mixture production|Refining by aromatic hydrocarbon hydrogenation,COMPANIA ESPANOLA DE PETROLEOS SA,2024,2
249,KR1020250078505A,페놀성 지질의 수소탈산소화 및 이로부터 생산된 재생 가능한 탄화수소 연료,Hydrocotyle bowlesioides|Hydrodeoxygenation|Phenolic lipid|Organic chemistry|Effluent,Electrolysis components|Liquid carbonaceous fuels|Liquid hydrocarbon mixture production|Adipic acid production|Caprolactum production,RENEWABLE ENERGY GRP INC,2025,2
250,ID202404287A,PROSES UNTUK MENINGKATKAN SUATU BAHAN BAKU OKSIGENAT MENJADI FRAKSI HIDROKARBON DAN PENGGUNAAN LAINNYA,Alkane|Hydrodeoxygenation|Process engineering|Oxygen compound|Jet fuel|Process plant|PARAFFIN HYDROCARBONS|Raw material|Chemical engineering,Hydrocarbon oil cracking|Liquid hydrocarbon mixture production|Treatment with hydrotreatment processes|Refining by aromatic hydrocarbon hydrogenation,SPANISH OIL CO LTD,2024,2
251,FR3154733A1,PROCEDE DE PRETRAITEMENT PAR HYDROLYSE D’UNE CHARGE HYDROCARBONEE D’ORIGINE NATURELLE,Alcohol|Hydrocotyle bowlesioides|Environmental engineering|Fatty acid|Hydrolysis|Free acid|Waste management,Fatty acids production/refining|Refining to change hydrocarbon structural skeleton|Preparation from carboxylic acid esters/lactones|Liquid carbonaceous fuels|Liquid hydrocarbon mixture production|Hydrocarbons|Hydrocarbon oil cracking|Treatment with hydrotreatment processes|Bio-feedstock|Hydrocarbon preparation|Hydrocarbon oils treatment products,TOTALENERGIES ONETECH,2025,2
252,FR3151599A1,Carburant aviation à teneur élevée en carburant renouvelable et à teneur réduite en composés aromatiques,Paraffin wax|Aryl|Kerosene|Aromatization|Environmental engineering|Fatty acid|Aviation fuel|Renewable fuels,Thermal non-catalytic cracking|Catalytic cracking|Liquid carbonaceous fuels|Liquid hydrocarbon mixture production|Hydrocarbon oils treatment products,TOTALENERGIES ONETECH,2025,2
259,CN119351132A,Method for producing biological aviation kerosene from high-acid-value oil,Oil and grease|Liquid product|Biodiesel|Ptru catalyst|Naphtha|Fluid phase|Fixed bed|Hydrodeoxygenation|Hydrogen treatment|Effluent,Liquid hydrocarbon mixture production|Bio-feedstock,ZHEJIANG UNIV,2025,2
261,KR1020250083954A,Apparatus and method for manufacturing sustainable refined oil using carbon dioxide included in waste plastic pyrolysis oil,Liquid hydrocarbons|Process engineering|Petroleum engineering|Carbon dioxide|Pyrolysis oil,Electrolysis components|Combustible gas catalytic treatment|Liquid hydrocarbon mixture production|Treatment with hydrotreatment processes|Hydrocarbon oils refining|Hydrocarbon oils treatment products,INST FOR ADVANCED ENG,2025,2
263,CN118562530A,Preparation method of low-freezing-point biodiesel,Liquid product|Biodiesel|Ptru catalyst|Fixed bed|Fractionation|Waste oil|Slurry|Hydrogen treatment|Chemistry|Fluid phase|Hydrogenation reaction|Process engineering|Effluent,Biofuels|Treatment with hydrotreatment processes|Hydrocarbon oils treatment products,SHANDONG HI TECH CHEM GROUP,2024,2
264,BR112015023479B1,REAÇÕES DE PIRÓLISE NA PRESENÇA DE UM ALCENO,Combinatorial chemistry|Alkene|Stereochemistry|Branched alkane|Pyrolysis,Thermal non-catalytic cracking|Fatty acid chemical modification|Biofuels|Liquid carbonaceous fuels|Liquid hydrocarbon mixture production|Bio-feedstock|Hydrocarbon oils treatment,FORGE HYDROCARBONS CORP,2022,2
266,KR102465215B1,Process for the production of high value chemicals from biologically produced materials,Alkane|Hydrocarbon mixtures|Process engineering|Biological materials|Ethylene|Carbon atom|Chemical engineering|Propene,Thermal non-catalytic cracking|Hydrogen|Liquid hydrocarbon mixture production|Bio-feedstock|Hydrogen/synthetic gas production|Bulk chemical production|Hydrocarbon by hydrocarbon cracking|Hydrocarbon oils treatment products,TOTAL RES & TECH FELUY,2022,2
267,KR102747125B1,증기첨가분해기용 바이오연료 및 바이오-공급원료를 생산하기 위한 개장된 화석 석유 정제소에서 재생 가능한 디젤 연료 생산,Alkane|Paraffin wax|Ptru catalyst|Hydrodesulfurization|Biofuel|Petroleum engineering|PARAFFIN HYDROCARBONS|Refinery|Fatty acid ester|Diene|Naphtha|Gasoline|Diluent|Alkene|Liquefied petroleum gas|Oil refinery|Diesel fuel|Fatty acid composition,Thermal non-catalytic cracking|Fatty acids production/refining|Liquid hydrocarbon mixture production|Hydrocarbon oil cracking|Treatment with hydrotreatment processes|Bio-feedstock|Chemical/physical/physico-chemical processes|Hydrocarbon oils treatment products,토탈에너지스 원테크 벨지움,2024,2
274,CN119875677A,一种生物沼气制备芳烃基可持续航煤的方法,-,Organic compound preparation|Gaseous fuels|Dispersed particle separation|Hydroxy compound preparation|Liquid hydrocarbon mixture production|Hydrocarbon by hydrocarbon condensation,SHANGHAI KEMISI NEW ENERGY TECH CO LTD,2025,2
275,CN120158323A,抗结焦稳定运行的废弃生物质生产航空燃料联产化工原料的设备及方法,Aviation|Fixed bed|Coke|Process engineering|Biomass|Aviation fuel|Pyrolysis|Raw material|Environmental geology|Crude oil,Liquid hydrocarbon mixture production|Treatment with hydrotreatment processes|Special form destructive distillation,SICHUAN UNIV,2025,2
282,CN117770450B,一种高纯度的辣椒素组合物及其制备方法和其应用,Food additive|Dihydrocapsaicin|Biochemical engineering|Process engineering|Food products|Mother liquor|Mouthfeel|Cis-Capsaicin,Carboxylic acid amide separation/purification|Solid sorbent liquid separation|Solution crystallization|Food science,天津福来特新材料科技有限公司 | 赤峰福来特化工有限公司,2024,2
283,CN118995265B,一种航空煤油的生产方法,Aviation|Kerosene|Dust control|Clean energy|Fossil fuel|Aviation kerosene|Acid gas|Raw material|Compressed hydrogen|Environmental geology|Water washing|Oxygen gas|Syngas|Gasoline|Process engineering|Co carbon monoxide|Aviation fuel|Diesel fuel|Evaporator,Gasification processes details|Treatment with hydrotreatment processes|Gas contaminants removal|Gas dust removal|Granular/pulverulent flues gasification,SEDIN ENG CO LTD,2025,2
285,CN119630766A8,组合物、方法和用途,-,Solid fuels|Liquid carbonaceous fuels|Liquid hydrocarbon mixture production|Special form destructive distillation,INOSPA FUEL PROFESSIONAL LTD,2025,2
319,JP7688665B2,減少した酸価を有する炭化水素組成物の製造方法および短鎖脂肪酸の単離方法,-,Organic anion exchangers|Hydrocarbon from oxygen organic compounds|Liquid hydrocarbon mixture production|Hydrocarbons|Adsorption purification/separation|Bio-feedstock|Extraction purification/separation|Refining with aqueous alkaline solutions|Hydrocarbon oils treatment,フォージ ハイドロカーボンズ コーポレーション,2025,2
15,US12247137B2,"Renewable, highly isoparaffinic distillate for solvent use",Physical chemistry|Process engineering|Solvent composition|Environmental geology,-,NESTE OYJ,2025,3
34,US20240271050A1,Systems and methods of converting renewable feedstocks into intermediate hydrocarbon blend stocks and transportation fuels,Naphtha|Gasoline|Process engineering|Internal combustion engine|Diesel fuel|Environmental geology|Transportation fuel,Biofuels|Liquid carbonaceous fuels|Liquid hydrocarbon mixture production|Bio-feedstock|Fuel additives|Fermentation,MARATHON PETROLEUM,2024,3
38,US20250043207A1,Methods and uses relating to fuel compositions,Acyl group|Process engineering|Diesel engine|Indirect injection|Diesel fuel|Ammonium|Tertiary amine|Chemical engineering|Acide succinique,Liquid carbonaceous fuels|Fuel additives,INNOSPEC LTD,2025,3
40,CA3131144C,Diesel fuel composition,Process engineering|Oxidation stability|Fatty acid methyl ester|Diesel fuel|Environmental geology,Liquid carbonaceous fuels,NESTE OYJ,2025,3
50,US11613718B2,Fuel composition and method for producing a fuel composition,Thermodynamics|Petroleum|Jet fuel|Petroleum engineering|Cetane number,Biofuels|Efficient propulsion technologies|Liquid carbonaceous fuels|Fuel additives|Hydrocarbon oils treatment products,NESTE OYJ,2023,3
57,US20250084323A1,Middle distillate fuel from organic material of biological origin,-,-,NESTE OYJ,2025,3
65,WO2024180333A1,"Composition, method and use for reducing emissions of a diesel engine",Particulates|Ammonium compounds|Dieseling|Environmental engineering|Diesel engine|Diesel fuel,Liquid carbonaceous fuels|Fuel additives,INNOSPEC LTD,2024,3
74,CA2843232C,Fuel compositions,Aryl|Mannich reaction|Phenol|Medicinal chemistry|Ammonium|Diesel fuel|Acylation|Aldehyde|Carbon atom|Environmental geology|Reaction product,Liquid carbonaceous fuels|Fuel additives,INNOSPEC LTD,2021,3
79,US20250051673A1,Fuel compositions,Acyl group|Diesel fuel|Tertiary amine|Environmental geology|Chemical engineering|Acide succinique,Liquid carbonaceous fuels|Fuel additives,INNOSPEC LTD,2025,3
81,US20250002800A1,Marine fuel base comprising a component of renewable origin and method for manufacturing same,Process engineering|Fatty acid|Marine fuel|Environmental geology,Thermal non-catalytic cracking|Liquid carbonaceous fuels|Fuel additives|Hydrocarbon oils treatment products,TOTALENERGIES ONETECH,2025,3
87,CA2918057C,Fuel compositions,Diesel injector|Carboxylic salt|Carboxylic acid|Ammonium|Chemistry|Acylation|Environmental geology|Reaction product|Diesel injection,Non-fuel substance addition to fuel|Machines/engines|Liquid carbonaceous fuels|Fuel additives,INNOSPEC LTD,2022,3
89,US20250198978A1,Screening method for raw materials of high-yield sustainable aviation fuel,Vegetable oil|Isomerization|Hydrodeoxygenation|Process engineering|Biology|Jet fuel|Environmental protection|Aviation fuel|Raw material|Fatty acid composition,Fuel testing,HUBEI TIANJI BIOENERGY CO LTD,2025,3
92,EP4530334A3,Jet fuel composition and method for producing a jet fuel composition,Thermodynamics|Fatty acid|Jet fuel|Petroleum engineering|Freezing point,Liquid carbonaceous fuels,TOTALENERGIES ONETECH,2025,3
94,EP4532640A1,Heavy distillate composition,-,Liquid carbonaceous fuels,EXXONMOBIL TECHNOLOGY & ENGINEERING CO,2025,3
96,CA3245908A1,Lubricant compositions containing styrenic block copolymer,Polymer science|Base oil|Conjugated diene|Styrene,Additives,INFINEUM INT LTD,2025,3
100,WO2025022118A1,Methods and uses relating to reducing NOX emissions from a diesel engine by nitrogen containing detergents,Nitrogen oxides|Nitrogen dioxide|Environmental engineering|Nitrogen gas|Diesel engine|Diesel fuel|Environmental chemistry,Liquid carbonaceous fuels|Fuel additives,INNOSPEC LTD,2025,3
101,US20240141156A1,Functionalized C4 to C5 Olefin Polymers and Lubricant Compositions Containing Such,Imide|Polymer science|Butadiene Dioxide|Olefin polymerization|Alkene|Isoprene|Functionalized polymer|Amide,Gaseous fuels|Liquid carbonaceous fuels|Additives|Fuel additives,INFINEUM INT LTD,2024,3
102,SG10202402918TA,Lubricating oil compositions with improved wear performance and engine cleanliness,Oil additive|Base oil|Diesel engine|Materials science|Functionalized polymer|Sulphate salt|Sulfur content|Environmental geology,-,INFINEUM INT LTD,2025,3
103,EP4545621A3,Lubricant compositions containing high c9 disubstituted diphenylamine antioxidant content,Crankcase|Alkyl substitution|Phenyl group|Medicinal chemistry|Anti oxidant|Oxidizing agent|Lubricant|Diphenylamine,Additives,INFINEUM INT LTD,2025,3
105,US20250197761A1,Lubricant Compositions Containing Magnesium Detergent For Reduced Pre-ignition In Hydrogen Fueled Engines,Total Base Number|Sulfonate|Viscosity grade|Combustion|Hydrogen fuel|Internal combustion engine|Base oil|Magnesium|Sulfonic acid|Inorganic chemistry,Engine operations|Machines/engines|Additives,INFINEUM INT LTD,2025,3
106,US20250197755A1,Lubricant Compositions Containing Molybdenum For Reduced Pre-ignition In Hydrogen Fueled Engines,Total Base Number|Viscosity grade|Combustion|Molybdenum compounds|Hydrogen fuel|Internal combustion engine|Base oil|Environmental geology|Chemical engineering,Additives|Base-materials,INFINEUM INT LTD,2025,3
109,US20250207054A1,Lubricant Compositions Providing Robust Valvetrain Wear Protection in the Ford 6.7L Engine Test,-,-,INFINEUM INT LTD,2025,3
110,GB2622678B,Improvements in fuels,Process engineering|Environmental engineering|Chemistry|Waste management,Biofuels|Liquid carbonaceous fuels|Fuel additives,INNOSPEC FUEL SPECIALTIES LLC,2025,3
111,US20250197765A1,Lubricant Compositions Containing Phosphorus For Use In Hydrogen Fueled Engines,Hydrogen fuel|Internal combustion engine|Zinc dithiophosphate|Lubrication Agents|Phosphorus containing,Non-fuel substance addition to fuel|Machines/engines|Additives,INFINEUM INT LTD,2025,3
112,WO2025132964A1,Lubricant compositions containing c8 disubstituted diphenylamine antioxidant,-,-,INFINEUM INT LTD,2025,3
113,WO2025051934A1,Process for producing a jet fuel from feedstocks of renewable origin,-,-,TOTALENERGIES ONETECH,2025,3
114,CA3255774A1,Lubricant formulations containing functionalized olefin polymers and reduced traditional dispersant,Polymer science|Backbone chain|Alpha-olefin|Olefin polymerization|Base oil|Alkene|Hydroxy group|Functionalized polymer|Conjugated diene|Lubrication Agents|Acylation,Additives,INFINEUM INT LTD,2025,3
115,WO2025125894A1,Lubricant compositions containing magnesium detergent for reduced pre-ignition in hydrogen fueled engines,Total Base Number|Sulfonate|Viscosity grade|Combustion|Potassium hydroxide|Hydrogen fuel|Internal combustion engine|Base oil|Potassium oxide|Sulfonic acid|Inorganic chemistry,Additives,INFINEUM INT LTD,2025,3
116,CA3249121A1,Flat oil viscosity lubricant compositions,Physical chemistry|Oil viscosity|Viscosity index|Base oil|Copolymer|Viscosity modifier|Environmental geology|Chemical engineering,Thickeners|Additives,INFINEUM INT LTD,2025,3
117,WO2025126133A1,Lubricant compositions containing phosphorus for use in hydrogen fueled engines,Physical chemistry|Hydrogen fuel|Internal combustion engine|Zinc dithiophosphate|Lubricant|Motor oil|Mean effective pressure|Phosphorus containing|Environmental geology,Lubricant composition,INFINEUM INT LTD,2025,3
121,US20240141252A1,Lubricant Composition Containing Metal Alkanoate,Total Base Number|Base oil|Materials science|Carbon atom|Alkanoic acid|Chemical engineering|Quaternary carbon,Machines/engines|Additives|Lubrication pressure control,INFINEUM INT LTD,2024,3
122,US20250197763A1,Lubricant Compositions Containing Silicon For Reduced Pre-ignition In Hydrogen Fueled Engines,Total Base Number|Viscosity grade|Combustion|Hydrogen fuel|Internal combustion engine|Base oil|Components of crude oil|Silicon|Sulphate salt|Environmental geology|Chemical engineering,Electrical control|Machines/engines|Additives|Fuel injection control,INFINEUM INT LTD,2025,3
124,US20250197762A1,Lubricant Compositions For Reduced Pre-ignition In Hydrogen Fueled Engines,Total Base Number|Internal combustion engine|Thiophosphoric acid|Sulfonic acid|Inorganic chemistry|Sulfonate|Viscosity grade|Combustion|Hydrogen fuel|Zinc dithiophosphate|Octyl salicylate|Sulphate salt|Magnesium,Engine operations|Machines/engines|Additives,INFINEUM INT LTD,2025,3
125,US20250197764A1,Lubricant Compositions Containing Detergent For Reduced Pre-ignition In Hydrogen Fueled Engines,Total Base Number|Viscosity grade|Combustion|Potassium hydroxide|Hydrogen fuel|Internal combustion engine|Base oil|Components of crude oil|Potassium oxide|Environmental geology|Chemical engineering,Electrical control|Machines/engines|Additives|Fuel injection control,INFINEUM INT LTD,2025,3
126,EP4357443B1,Lubricating oil compositions,-,Liquid carbonaceous fuels|Machines/engines|Additives|Lubrication pressure control,INFINEUM INT LTD,2025,3
127,WO2025126134A1,Lubricant compositions containing detergent for reduced abnormal combustion events in hydrogen fueled engines,Total Base Number|Viscosity grade|Combustion|Potassium hydroxide|Hydrogen fuel|Base oil|Internal combustion engine|Inorganic chemistry,Additives,INFINEUM INT LTD,2025,3
129,US20250188379A1,Fused-ring polycyclic amine functionalized olefinic polymers for lubricating oil compositions,Polymer science|Heteroatom|Olefin polymerization|Alkene|Polymer|Cyclic amines,Additives|Base-materials,INFINEUM INT LTD,2025,3
131,WO2025007042A3,Hydroconversion of a biomass feedstock to hydrocarbon fuels in a slurry phase catalyst reactor,Ptru catalyst|Reactor system|Hydrocotyle bowlesioides|Hydrodeoxygenation|Gasoline|Fuel oil|Process engineering|Diesel fuel|Phosphorus containing|Environmental geology|Biomass feedstock,Fatty acid esterification|Liquid carbonaceous fuels,CHEVRON USA INC,2025,3
132,CA3247649A1,Lubricating oil compositions and use thereof for improving journal bearing durability in internal combustion engines,Glycerol dioleate|Physical chemistry|Bearing wear|Internal combustion engine|Base oil|Shear viscosity|Friction modifier|Glycerol Trioleate|Environmental geology|Glycerol monooleate,Additives,INFINEUM INT LTD,2025,3
133,CA3247640A1,Lubricating oil compositions and use thereof for improving journal bearing wear in internal combustion engines,Physical chemistry|Bearing wear|Internal combustion engine|Base oil|Shear viscosity|Magnesium|Environmental geology|Chemical engineering,Additives,INFINEUM INT LTD,2025,3
135,WO2025126063A1,Lubricant compositions containing silicon for reduced pre-ignition in hydrogen fueled engines,Total Base Number|Viscosity grade|Combustion|Hydrogen fuel|Internal combustion engine|Base oil|Components of crude oil|Silicon|Sulphate salt|Environmental geology|Chemical engineering,Lubricant composition,INFINEUM INT LTD,2025,3
136,WO2025125892A1,Lubricant compositions containing molybdenum for reduced pre-ignition in hydrogen fueled engines,Total Base Number|Viscosity grade|Combustion|Molybdenum compounds|Hydrogen fuel|Internal combustion engine|Base oil|Environmental geology|Chemical engineering,Lubricant composition,INFINEUM INT LTD,2025,3
137,WO2025125893A1,Lubricant compositions for reduced pre-ignition in hydrogen fueled engines,Total Base Number|Internal combustion engine|Thiophosphoric acid|Sulfonic acid|Inorganic chemistry|Sulfonate|Viscosity grade|Combustion|Hydrogen fuel|Zinc dithiophosphate|Octyl salicylate|Sulphate salt|Magnesium,Additives,INFINEUM INT LTD,2025,3
138,PH12023551022U3,Use of a diesel fuel composition,Biodiesel|Exhaust fumes|Exhaust gas recirculation|Diesel fuel,Liquid carbonaceous fuels|Fuel additives,SHELL INTERNATIONALE RESEARCH MAATSCHAPPIJ BV,2024,3
142,WO2025132945A1,Lubricant compositions containing aralkyl substituted diphenylamine antioxidant,-,-,INFINEUM INT LTD,2025,3
143,WO2025120367A1,Fused-ring polycyclic amine functionalized olefinic polymers for lubricating oil compositions,Polymer science|Heteroatom|Olefin polymerization|Alkene|Polymer|Cyclic amines,Additives,INFINEUM INT LTD,2025,3
145,SG10202400001TA,Method for Reduction of Abnormal Combustion Events,Physical chemistry|Process engineering|Base oil|Internal combustion engine|Cleanser|Environmental geology|Octane rating,-,INFINEUM INT LTD,2024,3
146,EP4259759A1,Use of a paraffinic gasoil,-,Biofuels|Efficient propulsion technologies|Liquid carbonaceous fuels|Hydrocarbon oils refining|Fuel additives,SHELL INTERNATIONALE RESEARCH MAATSCHAPPIJ BV,2023,3
147,EP4259756B1,Use of a detergent additive,-,Liquid carbonaceous fuels|Fuel additives,SHELL INTERNATIONALE RESEARCH MAATSCHAPPIJ BV,2025,3
151,US20250206952A1,"Compositions, methods and uses",-,-,INNOSPEC LTD,2025,3
153,CA2699924C,Fiber-containing carbohydrate composition,Oligomer|Chemical compound|Digestion|Carbohydrate composition|Oligosaccharide|Ingested food|Fiber carbon|Food products|Starch|Monosaccharide,Frozen sweets|Confectionery|Sweetmeats|Cocoa|Cheese manufacture|Fermentation|Oligosaccharide food ingredients|Milk preparation|Sugar derivatives|Food ingredient as taste affecting agent|Food coating|Oligosaccharides|Food shaping|Sugar derivatives preparation,TATE & LYLE INGREDIENTS AMERICAS INC,2022,3
154,GB2625160B,Fuel compositions,-,Liquid carbonaceous fuels|Fuel additives,INNOSPEC LTD,2025,3
156,WO2025133517A1,Use of a renewable fuel composition for pilot injection in a dual-fuel engine,-,-,TOTALENERGIES ONETECH,2025,3
158,WO2024134058A1,"Fuel composition comprising a renewable base, a fatty acid ester and an alkyl-phenol additive",Alkane|Engineering|Ethyl ester|Alkyl substitution|Fatty acid methyl ester|Diesel engine|Medicinal chemistry|Polymer chemistry|PARAFFIN HYDROCARBONS|Fatty acid ester|Alkyl phenols,Liquid carbonaceous fuels|Fuel additives,TOTALENERGIES ONETECH,2024,3
181,TH2301002684A,"วิธีการสำหรับการผลิตส่วนย่อยผลิตภัณฑ์การแยกสลาย ซึ่งประกอบรวมด้วย โพรพิลีน, C4 โอเลฟิน, หรือทั้งสอง",-,-,เนสเต ออยจ์,2024,3
198,BR112021011083B1,COMPOSIÇÃO DE COMBUSTÍVEL DIESEL,-,Organic chemistry|Organic compound preparation|Refining to change hydrocarbon structural skeleton|Liquid carbonaceous fuels|Liquid hydrocarbon mixture production|Fuel additives,NESTE OYJ,2024,3
220,BR112024025618B1,MÉTODO E SISTEMA PARA TRATAR MATÉRIAS-PRIMAS RENOVÁVEIS,-,-,DUKE TECH LLC,2025,3
221,BR112014002539B1,"COMPOSIÇÃO DE COMBUSTÍVEL DIESEL, PACOTE DE ADITIVO E MÉTODO DE OPERAÇÃO DE UM MOTOR A DIESEL",Mannich reaction|Control theory|Phenol|Mechanical engineering|Diesel engine|Diesel fuel|Aldehyde,Liquid carbonaceous fuels|Fuel additives,INNOSPEC LTD,2021,3
229,CN113227333B,季铵化合物和燃料组合物,Ammonium compounds|Combinatorial chemistry|Hydrocarbon|Chemical engineering,Organic compound preparation|Carboxylic acid esters preparation|Liquid carbonaceous fuels|Additives|Fuel additives|Amino-hyroxy compound preparation,INNOSPEC LTD,2023,3
230,CN110536954B,方法和用途,Alcohol|Carboxylic acid|Medicinal chemistry|Acid anhydride|Diesel fuel,Liquid carbonaceous fuels|Fuel additives,INNOSPEC LTD,2023,3
237,BR112021010292B1,MISTURA DE COMBUSTÍVEIS RENOVÁVEIS,-,Liquid carbonaceous fuels,NESTE OYJ,2024,3
246,KR102703328B1,"Waterproofing method, equipment, material",Architectural engineering|Landscaping|Mechanical engineering|Green roof|Botanical garden|Raw material|Parking lot|Environmental geology|Waterproofing,Build-up roofs|Building repairs|Polyurea/polyurethane coatings|Building insulations|Bituminous coatings,KOREA PARAMOUNT | TECHOECO,2024,3
253,FR3143625B1,"Composition de carburant comprenant une base renouvelable, un ester d’acide gras et un additif polysiloxane",Polymer science|Ethyl ester|Fatty acid methyl ester|Diesel fuel|Composite material|Fatty acid ester|Polysiloxene,Liquid carbonaceous fuels|Fuel additives,TOTALENERGIES ONETECH,2024,3
254,ES2926549T3,Uso relacionado con composiciones de combustible,Phenol|Diesel engine|Aldehyde formation|Diesel fuel|Chemical engineering|Medium molecular weight,Fuel injection apparatus|Engine operations|Machines/engines|Liquid carbonaceous fuels|Fuel additives,INNOSPEC LTD,2022,3
257,BR112025001380A2,APRIMORAMENTOS EM COMBUSTÍVEIS,-,-,INNOSPEC FUEL SPECIALTIES LLC,2025,3
260,JP2024054730A,Aviation fuel oil and base material for aviation fuel oil,Alkane|Chemical treatment|Hydrodesulfurization|Kerosene|Distillation|Oxidation stability|Atmospheric distillation of crude oil|Petroleum engineering|Aviation fuel|PARAFFIN HYDROCARBONS|Sulfur content|Crude oil,Liquid carbonaceous fuels,COSMO OIL CO LTD,2024,3
265,IN452441B,Biogenic low viscosity insulating oil,Alkane|Paraffin wax|Isomerization|Distillation|Physical chemistry|Base oil|Anti oxidant|Petroleum engineering|PARAFFIN HYDROCARBONS|Straight chain,Liquid organic insulators|Additives|Base-materials,AVANTHERM | NESTE OYJ,2023,3
269,BR112021024866B1,ÓLEO DE PENETRAÇÃO E MÉTODO PARA PRODUZIR O MESMO,-,Base-materials,NESTE OYJ,2024,3
270,IN202241027319A,Production of green diesel from simarouba-glauca oil for diesel engine vehicles,Vegetable oil|Diesel engine|Transformation ratio|Simarouba|Petroleum engineering|Decarbonylation|Hydrodeoxygenation|Process engineering|Decarboxylation|Aluminium oxides|Diesel fuel|Molybdenum|Biolipid,Pulp liquor regeneration|Casings|Exhaust apparatus|Dispersed particle separation|Combustion engines|Silencing apparatus,MR PELLURU SURESH,2022,3
271,KR1020250006192A,생분해성 직접 침지 냉각 유체,Alkane|Polymer science|Arame|PARAFFIN HYDROCARBONS|Composite material|Biodegradation,Secondary cells|Heat-exchange elements|Cooling/ventilation/heating modifications|Batteries,TOTALENERGIES ONETECH,2025,3
272,CN118995260B,一种生物航煤的生产方法,Ptru catalyst|Waste oil|Methanol|Raw material|Environmental geology|Chemical engineering|Pressure reactor|Process engineering|Microbiology|Fermentation broth|Phosphotungstic acid|Class Clostridia|Clostridium,-,LUOYANG HENGJIU BIOENERGY CO LTD | HENAN JUNHENG IND GRP BIOTECH CO LTD,2025,3
273,MY201926A,Biological methods for preparing terpenes,Biotechnology|Microorganism|Microbiology|Biological organism|Cell|Terpene,Fungi|Fermentation|Vector-based foreign material introduction|DNA/RNA fragmentation,RADICI CHIM,2024,3
276,MY200799A,Biological methods for modifying cellular carbon flux,Cell biology|Organic molecules|Cell|Biophysics,Fungi|Oxidoreductases|Vector-based foreign material introduction|DNA/RNA fragmentation,RADICI CHIM,2024,3
279,JP2022151754A5,Aviation fuel oil and base material for aviation fuel oil,-,Liquid carbonaceous fuels,COSMO OIL CO LTD,2022,3
